date,username,to,replies,retweets,favorites,text,geo,mentions,hashtags,id,permalink
2019-07-20 08:41:29,rozhoon,UMMcampus,0,0,1,"Itu ada cowonya mimi peri...",,,,1152498751233122307,https://twitter.com/rozhoon/status/1152498751233122307
2019-07-20 04:16:50,putridenadaa,UMMcampus,0,0,2,"weee jadi pengen masuk UMM kalo katingnya model gini",,,,1152432151620489217,https://twitter.com/putridenadaa/status/1152432151620489217
2019-07-20 02:44:38,meongie04,nidaauliar,1,0,0,"Kalo iyee ada yanh kayak baekhyun, rela pindah kampus gueee",,,,1152408947988373505,https://twitter.com/meongie04/status/1152408947988373505
2019-07-19 18:05:02,kakgeygey,zannubaaaaa,1,0,1,"Tolong @hikmamchtr",,@hikmamchtr,,1152278187616849921,https://twitter.com/kakgeygey/status/1152278187616849921
2019-07-19 16:35:31,camaldal,UMMcampus,1,0,1,"@aplutodust @pepeskadal di umm nih gais",,@aplutodust @pepeskadal,,1152255658139369472,https://twitter.com/camaldal/status/1152255658139369472
2019-07-19 16:33:23,rongrongput,rulyandinip,0,0,1,"Wadaawwww.. kalo bgini mau aku kuliah lagi",,,,1152255122207961088,https://twitter.com/rongrongput/status/1152255122207961088
2019-07-19 15:23:48,hheralterego,zannubaaaaa,0,0,1,"Loalah angkatanku ko gaonok rek minggu ae ngampus aku lek onok arek kyk ngene.",,,,1152237609491419136,https://twitter.com/hheralterego/status/1152237609491419136
2019-07-19 15:14:19,rulyandinip,UMMcampus,1,0,1,"@rongrongput katingmu mbak? Wkwk",,@rongrongput,,1152235224287158278,https://twitter.com/rulyandinip/status/1152235224287158278
2019-07-19 13:40:18,wisqasavitri,zannubaaaaa,0,0,1,"almet kedodoran gitu aja cakep, pakabar kiteee :(",,,,1152211564235124736,https://twitter.com/wisqasavitri/status/1152211564235124736
2019-07-19 12:19:14,zannubaaaaa,,0,1,0,"Ini kating UMM yg tadi siang aku share kan yak? Mereka lagi ngampus ges, mereka gak bolos kok :v @UMMcampus #MGMAVOTE #EXO @weareoneEXOpic.twitter.com/oqDnjNoU5x",,@UMMcampus @weareoneEXOpic,#MGMAVOTE #EXO,1152191161424998401,https://twitter.com/zannubaaaaa/status/1152191161424998401
2019-07-19 11:46:53,lailyps14,UMMcampus,0,0,1,"Kalau kek gini auto lulusnya bareng aja meskipun lama gakpapa :')",,,,1152183020419346433,https://twitter.com/lailyps14/status/1152183020419346433
2019-07-19 11:35:24,wulanvska,anishaaapr,0,0,1,"Hahaha iyaa wehh baru aku mau mention km begituan",,,,1152180130325778432,https://twitter.com/wulanvska/status/1152180130325778432
2019-07-19 11:34:29,rararollaxyy,herluminescence,0,0,0,"Trus yg datang beda 180° waaa kecewa netijen",,,,1152179900557611008,https://twitter.com/rararollaxyy/status/1152179900557611008
2019-07-19 10:39:45,balqisslsbln,UMMcampus,1,0,1,"@lvniaypw mahasiswa baru UMM",,@lvniaypw,,1152166128090636288,https://twitter.com/balqisslsbln/status/1152166128090636288
2019-07-19 10:26:30,herluminescence,malikhaarb,0,0,0,"Iya poster open recruitment buat pesmaba nanti itu mal",,,,1152162790955577344,https://twitter.com/herluminescence/status/1152162790955577344
2019-07-19 10:25:47,herluminescence,rararollaxyy,1,0,0,"Foto pas mau ngisi safari pesmaba itu",,,,1152162611447775232,https://twitter.com/herluminescence/status/1152162611447775232
2019-07-19 10:23:40,real_novrizal,,0,0,0,"@UMMcampus untuk pembayaran SPP lewat BNI apa masih bermasalah?",,@UMMcampus,,1152162077781315585,https://twitter.com/real_novrizal/status/1152162077781315585
2019-07-19 09:16:16,kimbearbunn,kimbearbunn,0,0,0,"YaAlloh typo maba makstku",,,,1152145119610458112,https://twitter.com/kimbearbunn/status/1152145119610458112
2019-07-19 09:15:10,kimbearbunn,putriR__,1,0,0,"Wehh Mana fpp",,,,1152144838910853120,https://twitter.com/kimbearbunn/status/1152144838910853120
2019-07-19 08:02:48,malikhaarb,herluminescence,1,0,0,"Lohhh iyaaa taaa ?? wkwkkw",,,,1152126629310636032,https://twitter.com/malikhaarb/status/1152126629310636032
2019-07-19 07:51:37,Nicka_Clouds,UMMcampus,1,0,2,"Yang rambut putih cowonya @khymn_ jangan macem2 klean. :))",,@khymn_,,1152123813301067776,https://twitter.com/Nicka_Clouds/status/1152123813301067776
2019-07-19 07:04:13,diarymils,zannubaaaaa,0,0,3,"yaaa dulu barengan pas ngulang mata kuliah gara2 mereka sering absen kuliah dgn alasan klasik: manggung.",,,,1152111885342277633,https://twitter.com/diarymils/status/1152111885342277633
2019-07-19 06:44:04,Yunitamaulindas,RizkChigga,1,0,0,"Ikhlas aku tu dipaido ikhlas ((:",,,,1152106815242432512,https://twitter.com/Yunitamaulindas/status/1152106815242432512
2019-07-19 06:37:58,Yunitamaulindas,RizkChigga,1,0,0,"Lah kok? ((':",,,,1152105278390722560,https://twitter.com/Yunitamaulindas/status/1152105278390722560
2019-07-19 06:36:14,RizkChigga,Yunitamaulindas,1,0,0,"LAGI PMS",,,,1152104841923063808,https://twitter.com/RizkChigga/status/1152104841923063808
2019-07-19 06:35:02,Yunitamaulindas,RizkChigga,1,0,0,"Lah kok anda ngegas mas )):",,,,1152104543301201920,https://twitter.com/Yunitamaulindas/status/1152104543301201920
2019-07-19 06:00:44,putriR__,UMMcampus,1,0,1,"@klgdxxx kating neh(?)",,@klgdxxx,,1152095908772769792,https://twitter.com/putriR__/status/1152095908772769792
2019-07-19 05:41:19,zannubaaaaa,riebaebae,0,0,0,"Mbanya bikin ngakak Mungkin mereka masuk setelah mbanya udah lulus :v",,,,1152091024367337472,https://twitter.com/zannubaaaaa/status/1152091024367337472
2019-07-19 05:32:13,riebaebae,SetyaNdah,0,0,1,"Hahaha ayo wes cus.. opo nang kantin asri wae sejuk.. tapi awakdewe mlakune adoh",,,,1152088735283945472,https://twitter.com/riebaebae/status/1152088735283945472
2019-07-19 05:30:16,SetyaNdah,riebaebae,1,0,1,"Yuhh, goleki mereka jurusan opo, parani nang kelas e, ajak ngopi nang 3.5 (eh mbuh ini masih ada apa enggak",,,,1152088241232678912,https://twitter.com/SetyaNdah/status/1152088241232678912
2019-07-19 05:24:28,selviayuuu_na,Pufferrfish,0,0,0,"Wkwkwk",,,,1152086781250035713,https://twitter.com/selviayuuu_na/status/1152086781250035713
2019-07-19 05:21:59,riebaebae,zannubaaaaa,1,0,1,"Lapo angkatanku biyen ga ono seng modelane ngene",,,,1152086157619953664,https://twitter.com/riebaebae/status/1152086157619953664
2019-07-19 05:19:57,hanyaakunbaja,sienyrarestya_,2,0,1,"Ya allah reinkarnasi kuu",,,,1152085645810003969,https://twitter.com/hanyaakunbaja/status/1152085645810003969
2019-07-19 05:11:56,riebaebae,SetyaNdah,1,0,1,"EEEEEEEE MAMPOOOSSS AYO KULIAH MANEH",,,,1152083630857936898,https://twitter.com/riebaebae/status/1152083630857936898
2019-07-19 05:10:56,SetyaNdah,UMMcampus,1,0,1,"Ngahahaha jadi pen kulyah maneh piye mak @keyEkaria",,@keyEkaria,,1152083377123577856,https://twitter.com/SetyaNdah/status/1152083377123577856
2019-07-19 04:53:08,ulftr,UMMcampus,0,0,1,"seger kalik ya kalo ada beginian wkwk",,,,1152078898764500993,https://twitter.com/ulftr/status/1152078898764500993
2019-07-19 04:41:52,asakunation,UMMcampus,0,0,1,"ealah....ndisik gak onok rek.....",,,,1152076060688699392,https://twitter.com/asakunation/status/1152076060688699392
2019-07-19 04:07:38,bariasthetic,UMMcampus,0,0,0,"Pacarku iku min :v",,,,1152067445898670080,https://twitter.com/bariasthetic/status/1152067445898670080
2019-07-19 02:58:51,zannubaaaaa,SMTOWN_JKT,0,1,0,"Mon maap dia kating UMM bukan? Wahai anak UMM mintain nomer wassapnya dong pliss:"") @UMMcampus #MGMAVOTE #EXO @weareoneEXOpic.twitter.com/iVvC141v8r",,@UMMcampus @weareoneEXOpic,#MGMAVOTE #EXO,1152050137159520261,https://twitter.com/zannubaaaaa/status/1152050137159520261
2019-07-19 02:54:37,AgilMuchammad,zannubaaaaa,1,0,1,"Tonggoku wi",,,,1152049071688830976,https://twitter.com/AgilMuchammad/status/1152049071688830976
2019-07-19 00:22:21,zannubaaaaa,,8,21,23,"Mon maap cuman nanya. Adakah yg di UMM? Ini kating kalian bukan? Minta no wassapnya dong:"") @UMMcampus #MGMAVOTE #EXO @weareoneEXOpic.twitter.com/k2KZ0Ed4gU",,@UMMcampus @weareoneEXOpic,#MGMAVOTE #EXO,1152010754972798977,https://twitter.com/zannubaaaaa/status/1152010754972798977
2019-07-18 12:38:55,maharina4,,0,0,1,"TVC Terbaru UMM 2019 niiiiiih!!!. . Pendaftarannya Gel III UMM sudah dibuka mulai 15 Juli - 22 Agustus 2019. Segera chek di http://umm.ac.id Reposted from @ummcampus https://www.instagram.com/p/B0DvKgfFSh0/?igshid=xpyqz8us33xy …",,@ummcampus,,1151833727682654208,https://twitter.com/maharina4/status/1151833727682654208
2019-07-18 12:36:11,maharina4,,0,1,1,"TVC Terbaru UMM 2019 niiiiiih!!!. . Pendaftarannya Gel III UMM sudah dibuka mulai 15 Juli - 22 Agustus 2019. Segera chek di http://umm.ac.id Reposted from @ummcampus https://www.instagram.com/p/B0Du01ulc6R/?igshid=1s3med4dnr2i0 …",,@ummcampus,,1151833038306910210,https://twitter.com/maharina4/status/1151833038306910210
2019-07-18 04:54:31,UMMcampus,musmuliady_jahi,0,0,0,"Nanti dikira ikut-ikutan",,,,1151716860104081409,https://twitter.com/UMMcampus/status/1151716860104081409
2019-07-17 10:45:18,pindahkosmalang,ridafan13,0,0,1,"Terima kasih supportnya Kak",,,,1151442749263998977,https://twitter.com/pindahkosmalang/status/1151442749263998977
2019-07-17 09:43:54,ninduutttt,,0,0,0,"Min, gelar lulusan S1 ilmu komunikasi yg bener apa ya ? S.Kom, S.ikom atau S.I.Kom ? Thank you min Urgent !!! @UMMcampus",,@UMMcampus,,1151427294658879490,https://twitter.com/ninduutttt/status/1151427294658879490
2019-07-17 04:07:00,UMMcampus,,0,4,14,"Sinergi Kebangsaan, INTI-UMM Teken Kerja Sama | http://www.umm.ac.id/id/berita/sinergi-kebangsaan-intiumm-teken-kerja-sama.html … | #UMMCampuspic.twitter.com/q5Lz6xnUSe",,,#UMMCampuspic,1151342511392251904,https://twitter.com/UMMcampus/status/1151342511392251904
2019-07-17 03:06:00,UMMcampus,,0,0,2,"Kata Pakar Amerika tentang Empat Faktor yang Buat Teroris 'Pensiun' | http://www.umm.ac.id/id/berita/kata-pakar-amerika-tentang-empat-faktor-yang-buat-teroris-pensiun.html … | #UMMCampuspic.twitter.com/Fi6K7zbxdx",,,#UMMCampuspic,1151327159971008513,https://twitter.com/UMMcampus/status/1151327159971008513
2019-07-16 22:20:08,adityayul_10,,0,0,0,"Asisten lab komputasi LKEB @UMMcampus Angkatan 2014 pic.twitter.com/r10tIAHJ09",,@UMMcampus,,1151255219952443392,https://twitter.com/adityayul_10/status/1151255219952443392
2019-07-16 14:19:22,kstlni,,0,0,0,"@UMMcampus min mau nanya klo jurusan manajemen itu kampus berapa ?",,@UMMcampus,,1151134232154001411,https://twitter.com/kstlni/status/1151134232154001411
2019-07-16 12:27:21,Aruldagul,zunnunferdia,0,0,0,"yadong, langsung internasional",,,,1151106041439895553,https://twitter.com/Aruldagul/status/1151106041439895553
2019-07-16 12:07:16,zunnunferdia,Aruldagul,1,0,0,"mahal keknya promosinya ini wkwkwkw",,,,1151100989581090817,https://twitter.com/zunnunferdia/status/1151100989581090817
2019-07-16 12:04:00,UMMcampus,,0,0,3,"Mobil KaCa UMM di PSPA Bima Sakti: Adakan Outbond, Kelas Jurnalistik sampai Fotografi | http://www.umm.ac.id/id/berita/mobil-kaca-umm-di-pspa-bima-sakti-adakan-outbond-kelas-jurnalistik-sampai-fotografi.html … | #UMMCampuspic.twitter.com/H8OSEinkPc",,,#UMMCampuspic,1151100164888829952,https://twitter.com/UMMcampus/status/1151100164888829952
2019-07-16 11:32:55,istighfarbry,krishnaadityas,1,0,0,"Ayas di negara tumpang lur",,,,1151092344856256512,https://twitter.com/istighfarbry/status/1151092344856256512
2019-07-16 11:04:00,UMMcampus,,0,0,3,"Songsong Pimnas, UMM Jadi Tuan Rumah Monev PKM | http://www.umm.ac.id/id/berita/songsong-pimnas-umm-jadi-tuan-rumah-monev-pkm.html … | #UMMCampuspic.twitter.com/KGxPHtXowg",,,#UMMCampuspic,1151085065754906625,https://twitter.com/UMMcampus/status/1151085065754906625
2019-07-16 10:42:55,UMMcampus,,0,4,6,"Saat Mahasiswa Asing Juga Ikut KKN | http://www.umm.ac.id/id/berita/saat-mahasiswa-asing-juga-ikut-kkn.html … | #UMMCampuspic.twitter.com/QkXEB0h5Wd",,,#UMMCampuspic,1151079761826861057,https://twitter.com/UMMcampus/status/1151079761826861057
2019-07-16 09:47:07,Aruldagul,,3,28,28,"bukan editan, logo @UMMcampus emang ada di vlognya Will Smith, promosi gratis, tapi munculnya cuma sedetik pic.twitter.com/g81OfBpDfM",,@UMMcampus,,1151065719246737408,https://twitter.com/Aruldagul/status/1151065719246737408
2019-07-16 08:32:51,oktoberku,,1,0,0,"Butuh temen kontrak cewek nih. Sisa 1 kamar. Daerah suhat 3 menit dari polinema dan UB. Murah abis kak! Info 085745111955. Kamsia @mahasiswamlg @InfoPolinema @UB_Official @InfoUnisma @UMMcampus",,@mahasiswamlg @InfoPolinema @UB_Official @InfoUnisma @UMMcampus,,1151047026928488448,https://twitter.com/oktoberku/status/1151047026928488448
2019-07-15 11:28:36,andimahfu_ri,UMMcampus,0,0,1,"Selamat Universitas Muhammadiyah Mendunia @UMMcampus https://twitter.com/UMMcampus/status/1150700282474426368 …",,@UMMcampus,,1150728868262637570,https://twitter.com/andimahfu_ri/status/1150728868262637570
2019-07-15 10:33:32,zakyZk,kompascom,0,0,0,"Mosok kalah karo @UMMcampus sing parkir e gratis",,@UMMcampus,,1150715009162338304,https://twitter.com/zakyZk/status/1150715009162338304
2019-07-15 09:35:00,UMMcampus,,0,0,7,"Akrab dengan pepatah “Tuntutlah Ilmu sampai ke Negeri Cina”? Kini, civitas akademika #UMMCampus bisa mewujudkannya dengan Guangxi Normal University. Simak selengkapnya di video berikut ini! Full report, click here http://bit.ly/UMMdanGuangxi pic.twitter.com/rIFJq0gKZZ",,,#UMMCampus,1150700282474426368,https://twitter.com/UMMcampus/status/1150700282474426368
2019-07-15 08:59:12,Risanda_abe,,0,0,0,"Halo min @UMMcampus nanya untuk lowongan dosen UMM dibuka apa saja ya? Dikirimkan kemana berkasnya? http://bau.umm.ac.id/id/pages/lamaran-kerja-di-umm.html …",,@UMMcampus,,1150691270714462208,https://twitter.com/Risanda_abe/status/1150691270714462208
2019-07-15 08:54:39,Risanda_abe,,0,0,0,"@UMMcampus min mau nanya, lowongan dosen UMM buka prodi apa ya? Syarat bisa dikirimkan kemana ya? http://bau.umm.ac.id/id/pages/lamaran-kerja-di-umm.html …",,@UMMcampus,,1150690124952264704,https://twitter.com/Risanda_abe/status/1150690124952264704
2019-07-14 01:29:00,UMMcampus,,1,0,7,"BIPA UMM Latih Mahasiswa Asing Jadi Duta Budaya dan Bahasa Indonesia | http://www.umm.ac.id/id/berita/bipa-umm-latih-mahasiswa-asing-jadi-duta-budaya-dan-bahasa-indonesia.html … | #UMMCampuspic.twitter.com/f7I6nY7hgU",,,#UMMCampuspic,1150215585558433792,https://twitter.com/UMMcampus/status/1150215585558433792
2019-07-13 11:28:00,UMMcampus,,0,0,2,"Bupati Pekalongan dan UMPP Belajar Kelola PT Ke UMM | http://www.umm.ac.id/id/berita/bupati-pekalongan-dan-umpp-belajar-kelola-pt-ke-umm.html … | #UMMCampuspic.twitter.com/jOowYm2WaP",,,#UMMCampuspic,1150003940945121281,https://twitter.com/UMMcampus/status/1150003940945121281
2019-07-13 09:54:00,UMMcampus,,0,1,8,"Cegah Anak Antisosial dengan Berpetualang dan Berkebun | http://www.umm.ac.id/id/berita/cegah-anak-antisosial-dengan-berpetualang-dan-berkebun.html … | #UMMCampuspic.twitter.com/7V4DFqnui7",,,#UMMCampuspic,1149980285213319168,https://twitter.com/UMMcampus/status/1149980285213319168
2019-07-13 08:49:00,UMMcampus,,0,0,1,"BAPOMI Jatim Beri Mandat ke UMM Helat Pomda Futsal | http://www.umm.ac.id/id/berita/bapomi-jatim-beri-mandat-ke-umm-helat-pomda-futsal.html … | #UMMCampuspic.twitter.com/7kpJyx022U",,,#UMMCampuspic,1149963927393984513,https://twitter.com/UMMcampus/status/1149963927393984513
2019-07-13 07:45:00,UMMcampus,,1,1,8,"UMM Terjunkan Mahasiswa KKN di 6 Negara | http://www.umm.ac.id/id/berita/umm-terjunkan-mahasiswa-kkn-di-6-negara.html … | #UMMCampuspic.twitter.com/Hs05TI5z6B",,,#UMMCampuspic,1149947821275189248,https://twitter.com/UMMcampus/status/1149947821275189248
2019-07-13 06:37:00,UMMcampus,,0,2,1,"IKA UMM Kaltim Terima Hibah Tanah untuk Dirikan Politeknik Milenia | http://www.umm.ac.id/id/berita/ika-umm-kaltim-terima-hibah-tanah-untuk-dirikan-politeknik-milenia.html … | #UMMCampuspic.twitter.com/d2HHQ6KUZh",,,#UMMCampuspic,1149930708460326912,https://twitter.com/UMMcampus/status/1149930708460326912
2019-07-13 05:43:28,ayasFajar,UMMcampus,0,0,0,"Waduh aku harap-harap cemas",,,,1149917235785244672,https://twitter.com/ayasFajar/status/1149917235785244672
2019-07-13 05:33:00,UMMcampus,,0,1,4,"Seratus Lulusan UMM Dicetak Jadi Digipreneur | http://www.umm.ac.id/id/berita/seratus-lulusan-umm-dicetak-jadi-digipreneur.html … | #UMMCampuspic.twitter.com/cXi59LQ2c4",,,#UMMCampuspic,1149914602488115200,https://twitter.com/UMMcampus/status/1149914602488115200
2019-07-13 05:19:57,UMMcampus,,1,0,5,"Pasti lagi harap-harap cemas ya buat ujian hari hari Senin depan? Persiapkan dirimu sebaik mungkin ya! Perhatikan juga hal-hal berikut ya agar persiapanmu semakin mantap dan semangat menghadapi ujian. #UMMCampuspic.twitter.com/KBOh9G9KIk",,,#UMMCampuspic,1149911321015541760,https://twitter.com/UMMcampus/status/1149911321015541760
2019-07-13 05:05:45,UMMcampus,,0,0,20,"Langganan Juara Nasional, Bikin Nazar Sisihkan Separuh Hadiah Buat Sedekah | http://www.umm.ac.id/id/berita/langganan-juara-nasional-bikin-nazar-sisihkan-separuh-hadiah-buat-sedekah.html … | #UMMCampuspic.twitter.com/e9WfQr0Krk",,,#UMMCampuspic,1149907744889004033,https://twitter.com/UMMcampus/status/1149907744889004033
2019-07-13 03:51:58,masroorrrrrra,UMMcampus,0,0,0,"Hhha\hhahaa",,,,1149889175790821377,https://twitter.com/masroorrrrrra/status/1149889175790821377
2019-07-12 12:16:56,UMMcampus,,0,0,5,"Bulan Syawal identik dengan banyak banget undangan pernikahan yang nangkring di meja kantor juga berupa undangan digital. Seperti Kaleidoskop Juni 2019 berikut ini. Yuk flashback ke kegiatan bulan Juni! #UMMCampushttps://youtu.be/A8qEDrFIPD4",,,#UMMCampushttps,1149653869703512064,https://twitter.com/UMMcampus/status/1149653869703512064
2019-07-12 10:54:39,DaniKristianW,,0,0,1,"OPENING CEREMONY LIGA SUPER 1 MALANG FOOTBALL LEAGUE 2019....!!! Ayooo Rek Tanggal 13 Juli merapat di Stadion UMM @ummcampus akan yang menjadi Venue pertandingan Liga Super 1 MFL 2019 dan Akan ada Acara Opening Ceremony with @tanimaju.stanley Acara Mul… https://ift.tt/2NQQ66c pic.twitter.com/tkNOxprJoT",,@ummcampus @tanimaju,,1149633159924838400,https://twitter.com/DaniKristianW/status/1149633159924838400
2019-07-12 06:04:38,edipurwa,,0,0,0,"@UMMcampus Mahasiswa Asing Dilatih BIPA UMM Jadi Duta Budaya Indonesia https://jatim.sindonews.com/read/12419/1/mahasiswa-asing-dilatih-bipa-umm-jadi-duta-budaya-indonesia-1562861255 …",,@UMMcampus,,1149560178225758210,https://twitter.com/edipurwa/status/1149560178225758210
2019-07-12 04:27:26,infomalang,,0,12,10,"Ayooo Rek Tanggal 13 Juli merapat ke Stadion UMM @UMMcampus, Venue pertandingan Liga Super 1 @malangfootballleague 2019. Acara Mulai jam 07.00 WIB ya! pic.twitter.com/DXl1LSapEl",,@UMMcampus @malangfootballleague,,1149535717124526080,https://twitter.com/infomalang/status/1149535717124526080
2019-07-12 04:17:31,novitahk_,UMMcampus,0,0,0,"Tahu baksonya",,,,1149533219101929477,https://twitter.com/novitahk_/status/1149533219101929477
2019-07-12 04:10:24,UMMcampus,byoga19,1,0,1,"Kalau 3½-nya? #UMMCampus",,,#UMMCampus,1149531430063505409,https://twitter.com/UMMcampus/status/1149531430063505409
2019-07-11 22:42:23,adityayul_10,,0,0,1,"Dari pada mikirin mukidi, lebih baik kita olahraga lapangan basket @UMMcampus #MukidiDitolakRakyatpic.twitter.com/yNe0WhDuTg",,@UMMcampus,#MukidiDitolakRakyatpic,1149448880863379456,https://twitter.com/adityayul_10/status/1149448880863379456
2019-07-11 15:26:37,masaqin,rachajulian_,0,0,0,"@FattaAhmadan mungkin kampus saya salah dlm berijtihad",,@FattaAhmadan,,1149339215076847616,https://twitter.com/masaqin/status/1149339215076847616
2019-07-11 06:04:34,acaraMLG,,0,0,0,"@acaramedia | malangfootballleague . OPENING CEREMONY LIGA SUPER 1 MALANG FOOTBALL LEAGUE 2019....!!! Ayooo Rek Tanggal 13 Juli merapat di Stadion UMM @ummcampus akan yang menjadi Venue pertandingan Liga Super 1… https://www.instagram.com/p/BzxAgNYAnRP/?igshid=7e5argleqcuz …",,@acaramedia @ummcampus,,1149197772739866624,https://twitter.com/acaraMLG/status/1149197772739866624
2019-07-11 05:45:04,UMMcampus,,0,2,8,"Enak banget ya nyeruput es degan sambil jalan-jalan. Tapi, kalau pakai kantong plastik dan buang sembarangan jadi nggak kece. Apalagi, kena pengendara lain. Waduh gawat! #DimulaidariKamu, UMM mengajak untuk #DietSampahPlastik sekarang juga. #UMMCampushttps://www.youtube.com/watch?v=dyUgmrwii_g …",,,#DimulaidariKamu #DietSampahPlastik #UMMCampushttps,1149192863906877440,https://twitter.com/UMMcampus/status/1149192863906877440
2019-07-10 05:31:52,gemgyul,,0,0,0,"buat kamu yang tidak lulus SBMPTN langsung daftar @UMMcampus aja. #SBMPTN2019 #SBMPTN",,@UMMcampus,#SBMPTN2019 #SBMPTN,1148827153032548352,https://twitter.com/gemgyul/status/1148827153032548352
2019-07-10 02:45:41,dcemberain,lebahjelek,0,0,0,"kalo misal kamu gak masalah bisa daftar di universitas muhammadiyah malang kok. lingkungannya enak buat kuliah sama kegiatan kampus @UMMcampus https://twitter.com/lebahjelek/status/1148517716392697856 …",,@UMMcampus,,1148785332453703680,https://twitter.com/dcemberain/status/1148785332453703680
2019-07-09 14:27:22,khasiudin,novitahk_,0,0,1,"Opo maneh lek wis gkb 1 lift macet, alamat wes",,,,1148599531480768513,https://twitter.com/khasiudin/status/1148599531480768513
2019-07-09 14:11:10,novitahk_,khasiudin,1,0,0,"Iku sing ngawe kangen",,,,1148595452717256706,https://twitter.com/novitahk_/status/1148595452717256706
2019-07-09 14:07:28,khasiudin,novitahk_,1,0,0,"Kampus cocok gawe olahraga mbak, kan Universitas Munggah Mudun",,,,1148594521657217025,https://twitter.com/khasiudin/status/1148594521657217025
2019-07-09 13:56:19,Zie83132906,Muammaryahya_mr,0,0,0,"sesuai levelnya donk. demo parkiran wkwkwk. ini menggelikan",,,,1148591716007579649,https://twitter.com/Zie83132906/status/1148591716007579649
2019-07-09 13:45:14,novitahk_,,2,0,9,"Kampus kebangganku ora negeri, tapi mrinding ngerti kon pas klebu kene @UMMcampus . Pesmaba e, kampus e, melbu dome e, wisuda e. opo maneh dosen killer e #SBMPTN",,@UMMcampus,#SBMPTN,1148588925792878593,https://twitter.com/novitahk_/status/1148588925792878593
2019-07-09 13:03:51,yusiprelians,nyabilafir,0,0,0,"Promosi ya sist",,,,1148578514083336194,https://twitter.com/yusiprelians/status/1148578514083336194
2019-07-09 12:01:36,nyabilafir,,1,0,0,"(iii) buat dedek-dedek yang lagi sedih gagal SBMPTN. ga lolos PTN bukan akhir dari segalanya, apalagi kalo masih ada kampus swasta kece kayak @UMMcampus Akreditasinya A! Apalagi Ilmu Komunikasinya. uwuu! ga bakal nyesel lhoo! Silakan kalo mo bikin Jodipan part 2. hehe.. #SBMPTN",,@UMMcampus,#SBMPTN,1148562846600482816,https://twitter.com/nyabilafir/status/1148562846600482816
2019-07-09 11:57:36,merichaaaa,,1,3,3,"Kampus sing cocok bgt sm tujuan hidupmu, kayak @UMMcampus gitu misalnya :) It depends on you yaaa!! Nek aku sih, sangat cocok kuliah ndek kene. Apalagi di ikom-nya. Dosen2nya sgt millenial dan punya banyak ide2 segar. Anw, pendaftaran gel 2 masi dibuka. Cek aja di @UMMcampus :))",,@UMMcampus @UMMcampus,,1148561841678774272,https://twitter.com/merichaaaa/status/1148561841678774272
2019-07-09 11:37:04,andihardianto15,RamadhonyTri,0,0,0,"Jahat (Red: Teknologi Tinggi)",,,,1148556671486050304,https://twitter.com/andihardianto15/status/1148556671486050304
2019-07-09 11:36:04,RamadhonyTri,andihardianto15,1,0,0,"Kamera jahat",,,,1148556419785867264,https://twitter.com/RamadhonyTri/status/1148556419785867264
2019-07-09 10:29:09,andihardianto15,,1,6,18,"Lari Sore Sembari Menikmati Senja di Stadion Kebanggaan @UMMcampus pic.twitter.com/sPnao8wyrC – at Stadion UMM",,@UMMcampus,,1148539580649336832,https://twitter.com/andihardianto15/status/1148539580649336832
2019-07-09 09:33:50,mahfudhid,,0,0,0,"Gak lolos #SBMPTN?? Tetep semangat yahh.. Mungkin kamu bisa coba #SBMPTMu di PTMA (Perguruan Tinggi Muhammadiyah-Aisyiyah) se-Indonesia.. @muhammadiyah @PPAisyiyah @SBMPTMu @UMYogya @umsofficial_ @UMMcampus @unisa_yogya @diktilitbang https://twitter.com/mahfudhid/status/1148525305448939520 …pic.twitter.com/aI6NhsAjWN",,@muhammadiyah @PPAisyiyah @SBMPTMu @UMYogya @umsofficial_ @UMMcampus @unisa_yogya @diktilitbang,#SBMPTN #SBMPTMu,1148525659863408642,https://twitter.com/mahfudhid/status/1148525659863408642
2019-07-09 09:32:26,mahfudhid,,0,0,1,"Yo yg nggak keterima di #SBMPTN 2019.. Bisa coba di #SBMPTMu di PTMA (Perguruan Tinggi Muhammadiyah-Aisyiyah) se-Indonesia.. Selamat mencoba.. @SBMPTMu @UMYogya @umsofficial_ @UMMcampus pic.twitter.com/1OCydt7VKB",,@SBMPTMu @UMYogya @umsofficial_ @UMMcampus,#SBMPTN #SBMPTMu,1148525305448939520,https://twitter.com/mahfudhid/status/1148525305448939520
2019-07-09 06:32:57,dikiting,yacintaanggun,0,0,0,"Twiter plis du yor mejik.. Cc. @PemkotMalang @UMMcampus https://twitter.com/yacintaanggun/status/1148479879278551040 …",,@PemkotMalang @UMMcampus,,1148480140071985154,https://twitter.com/dikiting/status/1148480140071985154
2019-07-09 06:17:09,Tlempost,ustadtengkuzul,0,0,1,"Kata 'Pembantu"" yg di ketik. @ustadtengkuzul Keniatan dan Maksudnya apa dan Bagaimana ?? cc @nu_online @NahdatulUlama1 @MajelisUlamaID @muhammadiyah @UMMcampus @MPM_PPMuh @RadioMuh @TVMuhammadiyah @majalahSM @unmuha @infomuhamadiyah @MDMCIndonesia @MuhammadiyahGLhttps://twitter.com/ustadtengkuzul/status/1147826982853365761 …",,@ustadtengkuzul @nu_online @NahdatulUlama1 @MajelisUlamaID @muhammadiyah @UMMcampus @MPM_PPMuh @RadioMuh @TVMuhammadiyah @majalahSM @unmuha @infomuhamadiyah @MDMCIndonesia @MuhammadiyahGLhttps,,1148476161044828160,https://twitter.com/Tlempost/status/1148476161044828160
2019-07-09 05:12:52,Muammaryahya_mr,GundiDr,1,17,82,"Kami di @UMMcampus bayar parkir di komplek kampus adalah bentuk membantu membesarkan kampus. Klau demo minimal yaa karna kebijakan pemerintah yg tidak pro rakyat lah. https://twitter.com/GundiDr/status/1148266773562576896 …",,@UMMcampus,,1148459986965549057,https://twitter.com/Muammaryahya_mr/status/1148459986965549057
2019-07-09 04:43:25,batiklintangku,,0,0,0,"kecewa dg program KKN-UMM @UMMcampus @BemUmmhttps://m.timesindonesia.co.id/read/219624/20190708/204359/pengrajin-batik-tulis-tlogosari-kecewa-dengan-pogram-kknppm-umm/ …",,@UMMcampus @BemUmmhttps,,1148452572040007680,https://twitter.com/batiklintangku/status/1148452572040007680
