date,username,to,replies,retweets,favorites,text,geo,mentions,hashtags,id,permalink
2019-09-02 00:00:00,UMMcampus,,7,29,98,"Selamat datang mahasiswa baru angkatan 2019! #PesmabaUMM2019 #UMMCampuspic.twitter.com/GYZjeDK35M",,,#PesmabaUMM2019 #UMMCampuspic,1168312581242662913,https://twitter.com/UMMcampus/status/1168312581242662913
2019-09-01 23:44:33,yulinurul24_,Nelasyh_,1,0,0,"kejutannya, tiba2 dospem mu ngajak bimbingan mendadak",,,,1168308693609279488,https://twitter.com/yulinurul24_/status/1168308693609279488
2019-09-01 13:52:38,fisioterapiumm,,0,0,2,"FORTASI (Forum Taaruf dan Orientasi) Mahasiswa Fisioterapi Fakultas Ilmu Kesehatan Universitas Muhammadiyah Malang . . @ummcampus himateraumm @Fikes Umm Kampus II https://www.instagram.com/p/B13vZjknDQ3/?igshid=ok6em7qgf5er …",,@ummcampus @Fikes,,1168159732529389568,https://twitter.com/fisioterapiumm/status/1168159732529389568
2019-09-01 09:08:41,fatoni_afnan,Oyazizah,0,0,1,"Siap, silahkan berkreasi masing2",,,,1168088277007491072,https://twitter.com/fatoni_afnan/status/1168088277007491072
2019-09-01 09:01:02,Oyazizah,fatoni_afnan,1,0,2,"@MuhammadiyinGL Nanti @UMMcampus Bikin juga deh",,@MuhammadiyinGL @UMMcampus,,1168086350475608064,https://twitter.com/Oyazizah/status/1168086350475608064
2019-09-01 08:03:38,CandraDFebrian1,,0,3,0,"Ditemukan stnk A.N Asopah ini bisa diambil di lalapan sambel killer tirto utomo @infomalang @UMMcampus @mahasiswamlg",,@infomalang @UMMcampus @mahasiswamlg,,1168071905472962561,https://twitter.com/CandraDFebrian1/status/1168071905472962561
2019-09-01 08:02:44,CandraDFebrian1,,0,1,3,"Ditemukan ktp A.N Nabilah Ifani Aflah ini bisa diambil di lalapan sambel killer tirto utomo @infomalang @UMMcampus @mahasiswamlg",,@infomalang @UMMcampus @mahasiswamlg,,1168071678628225025,https://twitter.com/CandraDFebrian1/status/1168071678628225025
2019-08-31 14:23:28,OpoWoi,,0,0,0,"@UMMcampus tiap menyelenggarakan wisuda selalu seperti ini apakah ada upaya untuk menyelesaikan? Sudah 3 tahun selalu seperti ini dengan durasi kemacetan yang sulit ditoleransi. pic.twitter.com/G5MArarjuF",,@UMMcampus,,1167805104952528897,https://twitter.com/OpoWoi/status/1167805104952528897
2019-08-31 08:21:07,Faizal_ShahAlam,,0,0,1,"Gini masuk evaluasi kajian amdalalin @UMMcampus ndak sih? Macet parah. Cc: @PemkotMalang @dishubjatim @DishubMalang @JatimPemprov @e100ss @TidarSaktiFM",,@UMMcampus @PemkotMalang @dishubjatim @DishubMalang @JatimPemprov @e100ss @TidarSaktiFM,,1167713918732521478,https://twitter.com/Faizal_ShahAlam/status/1167713918732521478
2019-08-31 08:05:39,han_setyawan,,0,0,0,"@UMMcampus karena wisuda mahasiswanya jalan jari macet total. Apa gak bisa diatur gitu? Cc @infomalang",,@UMMcampus @infomalang,,1167710026519048192,https://twitter.com/han_setyawan/status/1167710026519048192
2019-08-31 02:32:34,wrdhkhh,wildaaanibrhm,0,0,0,"Gapaham lagi :(",,,,1167626202556690432,https://twitter.com/wrdhkhh/status/1167626202556690432
2019-08-31 02:31:48,ranselbiroe_,,0,0,0,"Dear wisudawan dan wisudawati hari ini di @UMMcampus yg klo gk salah berjumlah 2.330 orang, Selamat menempuh hidup baru. Bukan lagi hidup sebagai mahasiswa. Selamat naik level dan menemukan perjuangan yang sesungguhnya. Salam, Alumni UMM",,@UMMcampus,,1167626006393311233,https://twitter.com/ranselbiroe_/status/1167626006393311233
2019-08-31 02:30:03,wildaaanibrhm,botolfrestea,1,0,0,"Ealah sampe ditagg",,,,1167625567291596800,https://twitter.com/wildaaanibrhm/status/1167625567291596800
2019-08-31 02:28:33,wrdhkhh,botolfrestea,0,0,0,"Eh ya gak gitu :(",,,,1167625188868911104,https://twitter.com/wrdhkhh/status/1167625188868911104
2019-08-31 02:18:21,botolfrestea,wrdhkhh,2,0,0,"@UMMcampus dipanggil nih",,@UMMcampus,,1167622621527080961,https://twitter.com/botolfrestea/status/1167622621527080961
2019-08-30 16:41:29,fynstuthings,,0,0,0,"@UMMcampus min, dimana aku bisa menemukan foto resmi dekan dan wakilnya fikes yaaa hmmm",,@UMMcampus,,1167477451242405889,https://twitter.com/fynstuthings/status/1167477451242405889
2019-08-30 03:19:55,UMMcampus,rizax_f,0,0,0,"Siaaaaap",,,,1167275727529467906,https://twitter.com/UMMcampus/status/1167275727529467906
2019-08-30 03:19:43,UMMcampus,bulqi_,0,0,0,"Haduuuuu.... Itu salah jasnya atau...",,,,1167275679752183808,https://twitter.com/UMMcampus/status/1167275679752183808
2019-08-30 00:12:37,botolfrestea,tanya2rl,0,0,0,"@UMMcampus tahun lalu malah ngundang Via Vallen. Kurang apa coba?",,@UMMcampus,,1167228595812495362,https://twitter.com/botolfrestea/status/1167228595812495362
2019-08-29 11:51:09,botolfrestea,UMMcampus,0,0,1,"Buat panitia pesmaba, nitip dedek-dedek gemes jangan dimarahin yaa",,,,1167041995648323584,https://twitter.com/botolfrestea/status/1167041995648323584
2019-08-29 11:49:13,bulqi_,UMMcampus,1,0,0,"haduh Sik min, Jas ku kekecilan :(",,,,1167041509746569216,https://twitter.com/bulqi_/status/1167041509746569216
2019-08-29 10:42:04,rizax_f,UMMcampus,1,0,0,"Nitip para maba jangan di eksekusi kalo ngospeki ya",,,,1167024612388958208,https://twitter.com/rizax_f/status/1167024612388958208
2019-08-29 09:51:32,mohfadhils,UMMcampus,0,0,0,"siappp",,,,1167011896177774594,https://twitter.com/mohfadhils/status/1167011896177774594
2019-08-29 09:46:03,DamaiSambada,UMMcampus,0,0,0,"Sayap grak",,,,1167010516595695616,https://twitter.com/DamaiSambada/status/1167010516595695616
2019-08-29 09:44:48,UMMcampus,,6,1,17,"Siap untuk #JasMerahMob #PesmabaUMM2019?",,,#JasMerahMob #PesmabaUMM2019,1167010199380484096,https://twitter.com/UMMcampus/status/1167010199380484096
2019-08-28 17:28:48,lanovemRdnwu,FreeWestPapua,0,0,0,"Pernyataan yg hakiki Bangsa Papua @fahiraidris @mediaindonesia @Metro_TV @FA_Sukoharjo @sukoharjo_kab @CISCbrebes_ @BIGREDS_Tegal @UMMcampus @BurhanMuhtadi @saiful_mujani @bucinskincare @marlinamukti @mukaduaaa @niasolin @BIGREDS_PKL @MFMBatang @mulesyaberak @CISCpemalang @uajyhttps://twitter.com/FreeWestPapua/status/1166661883128111104 …",,@fahiraidris @mediaindonesia @Metro_TV @FA_Sukoharjo @sukoharjo_kab @CISCbrebes_ @BIGREDS_Tegal @UMMcampus @BurhanMuhtadi @saiful_mujani @bucinskincare @marlinamukti @mukaduaaa @niasolin @BIGREDS_PKL @MFMBatang @mulesyaberak @CISCpemalang @uajyhttps,,1166764583551266816,https://twitter.com/lanovemRdnwu/status/1166764583551266816
2019-08-28 17:23:08,lanovemRdnwu,NOS,0,0,0,"Plizzz siapa tokoh Indonesia yg mampu berdialog matang hakekat hidup dalam damai sejahtera ?? @mahasiswaUNS @UMMcampus @UNJ_Official @univ_indonesia @KompasTV @Metro_TV @mediaindonesia @CISCngawi @anakmudamagetan @MuhammadMika031 @PPPemudaMu @puspitacsr @unmuha @BEMUNShttps://twitter.com/NOS/status/1166693108270153729 …",,@mahasiswaUNS @UMMcampus @UNJ_Official @univ_indonesia @KompasTV @Metro_TV @mediaindonesia @CISCngawi @anakmudamagetan @MuhammadMika031 @PPPemudaMu @puspitacsr @unmuha @BEMUNShttps,,1166763156342857730,https://twitter.com/lanovemRdnwu/status/1166763156342857730
2019-08-28 09:43:52,Pedulirakyatcoi,,0,0,0,"Persiapan Diksuswati Tiga Nasional DPD IMM Sulsel, Pimpinan Silaturahim ke Ketua PWM https://www.pedulirakyat.co.id/persiapan-diksuswati-tiga-nasional-dpd-imm-sulsel-pimpinan-silaturahim-ke-ketua-pwm/3372/ … lewat @Pedulirakyatcoi.co.id @dppimm @IMMnews @imm_mks @MDMCIndonesia @UMMcampus",,@Pedulirakyatcoi @dppimm @IMMnews @imm_mks @MDMCIndonesia @UMMcampus,,1166647578458378240,https://twitter.com/Pedulirakyatcoi/status/1166647578458378240
2019-08-28 02:03:58,Blood4LifeID,,0,1,0,"#INFO #DonDar #Malang | 28 Agustus 2019 | 08.00 - selesai | Persada Hospital, Jl. Raden Panji Suroso No. 4 | @june_bfl cc @PemkotMalang @AremafcOfficial @UMMcampus @PersadaHospital @polinema_malang @UM_1954pic.twitter.com/AXrv1p66xU",,@june_bfl @PemkotMalang @AremafcOfficial @UMMcampus @PersadaHospital @polinema_malang @UM_1954pic,#INFO #DonDar #Malang,1166531838736764931,https://twitter.com/Blood4LifeID/status/1166531838736764931
2019-08-27 01:10:52,akucalonrektor,noooo_maru,1,0,0,"Sini ke malang:(",,,,1166156090725109760,https://twitter.com/akucalonrektor/status/1166156090725109760
2019-08-27 01:10:03,akucalonrektor,noooo_maru,1,0,0,"Ikut kemana mar wkwk",,,,1166155884466061312,https://twitter.com/akucalonrektor/status/1166155884466061312
2019-08-26 16:15:06,Blood4LifeID,,0,3,1,"#INFO #DonDar #Malang | 28 Agustus 2019 | 08.00 - selesai | Persada Hospital, Jl. Raden Panji Suroso No. 4 | @june_bfl cc @PemkotMalang @AremafcOfficial @UMMcampus @PersadaHospital @polinema_malang @UM_1954pic.twitter.com/5zSSjhqPeo",,@june_bfl @PemkotMalang @AremafcOfficial @UMMcampus @PersadaHospital @polinema_malang @UM_1954pic,#INFO #DonDar #Malang,1166021257403523072,https://twitter.com/Blood4LifeID/status/1166021257403523072
2019-08-26 08:52:22,hamambr,malikhaarb,0,0,0,"Untungnya ""masa masa itu"" udh lewat mal wkwkwk",,,,1165909841249832960,https://twitter.com/hamambr/status/1165909841249832960
2019-08-26 08:35:58,malikhaarb,hamambr,1,0,0,"Semogaa gak sampe banyak editan kek taun lalu",,,,1165905713710764033,https://twitter.com/malikhaarb/status/1165905713710764033
2019-08-23 22:41:39,KijangSuper3,,0,0,0,"@UMMcampus permis, pendaftaran s3 pai umm sampai kapan ya? Download form rekomendasi nya dimana ya? Terimakasih",,@UMMcampus,,1165031372647321600,https://twitter.com/KijangSuper3/status/1165031372647321600
2019-08-23 02:46:55,hevyrotation_,yeahmahasiswa,0,0,0,"salah satu rangkaian pengenalan kampus di UMM @UMMcampus gini kok kak ^^, hehe.. masuk pesantren selama seminggu ^^ tapi mengenai lulus IPKnya 4.00 semua sih itu bergantung usaha masing2 lagi semasa kuliahnya ^^ https://twitter.com/yeahmahasiswa/status/1164730089327566849 …",,@UMMcampus,,1164730710256545792,https://twitter.com/hevyrotation_/status/1164730710256545792
2019-08-23 01:14:40,Frouzzzii,thvnderst0rm,0,0,0,"Skr bangunan bnyak bermunculan",,,,1164707493810860032,https://twitter.com/Frouzzzii/status/1164707493810860032
2019-08-22 11:57:56,mohridhoi2,Jejaknaruto,1,0,0,"Ya aku lah",,,,1164506988723630081,https://twitter.com/mohridhoi2/status/1164506988723630081
2019-08-22 11:44:51,Jejaknaruto,mohridhoi2,1,1,1,"Kamu siapa siii",,,,1164503697537191936,https://twitter.com/Jejaknaruto/status/1164503697537191936
2019-08-22 11:21:15,Frouzzzii,,0,0,1,"Min @UMMcampus ini container samping rusunawa lagi mau bangun apa ya? pic.twitter.com/pV22sm02xE",,@UMMcampus,,1164497757815496704,https://twitter.com/Frouzzzii/status/1164497757815496704
2019-08-22 09:38:45,bramoke,masjidsoedirman,0,0,0,"Mohon buka aku InstaGram supaya info² tentang kajian ilmu dan ustadz yang membawakan materi nya bisa di upload disitu. Syukron - jazakumulloh khoir..",,,,1164471961818296320,https://twitter.com/bramoke/status/1164471961818296320
2019-08-22 07:53:27,ArieYudho,,0,0,1,"Kera Ngalam, Ndang Melu O @Kemendag @Kemenperin_RI @KemenkopUKM @PemkotMalang @unmermlg @UMMcampus @Polinema3 @ITN_Malang @bank_indonesia @KemenkeuRIpic.twitter.com/H2jQFpbLsq",,@Kemendag @Kemenperin_RI @KemenkopUKM @PemkotMalang @unmermlg @UMMcampus @Polinema3 @ITN_Malang @bank_indonesia @KemenkeuRIpic,,1164445462348226560,https://twitter.com/ArieYudho/status/1164445462348226560
2019-08-22 07:46:28,UMMcampus,_senjamu,0,0,1,"Kerja sama internasional #UMMCampus sudah terjaring di banyak negara dan organisasi. Di antaranya lewat program #ErasmusPlus dan @AIESECUMM. Pojok budaya seperti dari @amcorUMM juga tersedia di kampus kami. Selengkapnya di video profil berikut ini:).https://youtu.be/wIWzadgbRVA?t=319 …",,@AIESECUMM @amcorUMM,#UMMCampus #ErasmusPlus,1164443705970843649,https://twitter.com/UMMcampus/status/1164443705970843649
2019-08-22 06:56:53,Alyeemz,badhilahfauzie,0,0,0,"Nggak ragu soale wis mlebu pil wkwk",,,,1164431229837381634,https://twitter.com/Alyeemz/status/1164431229837381634
2019-08-22 06:21:48,mohridhoi2,badhilahfauzie,1,0,2,"Aku juga hehe",,,,1164422399217033217,https://twitter.com/mohridhoi2/status/1164422399217033217
2019-08-22 05:26:41,badhilahfauzie,UMMcampus,2,4,14,"Masi ragu kuliah di @UMMcampus??? Aku sih enggaaa https://twitter.com/UMMcampus/status/1164398131573710849 …",,@UMMcampus,,1164408528540356608,https://twitter.com/badhilahfauzie/status/1164408528540356608
2019-08-22 04:45:22,UMMcampus,,0,12,26,"Berbagai alasan jadi motivasi mahasiswa memilih #UMMCampus. Chayrul Ahmad menjatuhkan pilihan pertamanya untuk UMM. Simak alasan perancang desain jembatan kaca di KWJ ini selengkapnya! Raih mimpi, prestasi, & inspirasi seperti Chayrul dengan daftar di http://online.umm.ac.id .pic.twitter.com/c2WXn6DM8l",,,#UMMCampus,1164398131573710849,https://twitter.com/UMMcampus/status/1164398131573710849
2019-08-22 04:41:57,UMMcampus,zakidisini_,0,0,9,"Yakin nggak mau ospek di #UMMCampus ajahttps://twitter.com/zakidisini_/status/1164125809084264448 …",,,#UMMCampus,1164397272785797121,https://twitter.com/UMMcampus/status/1164397272785797121
2019-08-21 10:48:57,zakidisini_,zakidisini_,0,0,0,"@UMMcampus ngga mau retweet juga min?",,@UMMcampus,,1164127239891386368,https://twitter.com/zakidisini_/status/1164127239891386368
2019-08-21 05:23:04,Frouzzzii,,0,4,26,"Gk pernah bosan foto pemandangan ini @UMMcampus pic.twitter.com/gePNnXX8sA – at Gedung Kuliah Bersama (GKB) 2",,@UMMcampus,,1164045228560404480,https://twitter.com/Frouzzzii/status/1164045228560404480
2019-08-21 03:13:58,sosfisipumm,,0,0,0,"Segera daftarkan dirimu untuk kuliah di Sosiologi FISIP UMM sebelum waktunya habis! Masih ada hari ini dan besok! @ummcampus fisip_umm himasos.umm #kuliah #pendaftaran #pendaftarankuliah #sosiologiumm #sosiologi… https://www.instagram.com/p/B1aRkVqH_4E/?igshid=e8inzwqerdcf …",,@ummcampus,#kuliah #pendaftaran #pendaftarankuliah #sosiologiumm #sosiologi,1164012740479819777,https://twitter.com/sosfisipumm/status/1164012740479819777
2019-08-20 21:54:02,jerseymalang_,mahasiswamlg,0,0,0,"Cocok Dadi dosen ayas ya",,,,1163932228943937536,https://twitter.com/jerseymalang_/status/1163932228943937536
2019-08-20 13:33:52,mahasiswamlg,jerseymalang_,1,0,1,"Mantap pak suhe.",,,,1163806355867627520,https://twitter.com/mahasiswamlg/status/1163806355867627520
2019-08-20 11:51:33,ade_wido,UMMcampus,0,0,0,"Aku cinta mimin , keren kamu ini",,,,1163780607371075584,https://twitter.com/ade_wido/status/1163780607371075584
2019-08-20 10:11:57,UMMcampus,,0,1,5,"Mobil KaCa UMM Sosialisasi Mitigasi Bencana di Lereng Semeru | http://www.umm.ac.id/id/berita/mobil-kaca-umm-sosialisasi-mitigasi-bencana-di-lereng-semeru.html … | #UMMCampuspic.twitter.com/b5ly0BFBQC",,,#UMMCampuspic,1163755543913046019,https://twitter.com/UMMcampus/status/1163755543913046019
2019-08-20 10:10:51,UMMcampus,ade_wido,1,0,0,"Artinyaaaaa….",,,,1163755264614363138,https://twitter.com/UMMcampus/status/1163755264614363138
2019-08-20 10:10:28,UMMcampus,hadbinssy,0,1,1,"Wah… Selamat!",,,,1163755170003468288,https://twitter.com/UMMcampus/status/1163755170003468288
2019-08-20 06:40:43,kisno_umbar,,0,4,9,"Kenalkan Budaya Malang di Forum Internasional, AIESEC in UMM Gelar Global Village Festival Summer @UMMcampus @HUMAS_UMMhttps://www.telaah.id/2019/08/20/kenalkan-budaya-malang-di-forum-internasional-aiesec-in-umm-gelar-global-village-festival-summer/ …",,@UMMcampus @HUMAS_UMMhttps,,1163702382938611712,https://twitter.com/kisno_umbar/status/1163702382938611712
2019-08-20 04:44:25,hadbinssy,,2,1,8,"Alhamdulillah, thank you @UMMcampus pic.twitter.com/mmRNEd4mlR",,@UMMcampus,,1163673117199228928,https://twitter.com/hadbinssy/status/1163673117199228928
2019-08-20 02:37:32,lavageul,,0,0,0,"@UMMcampus min pengumuman jam berapa ya?",,@UMMcampus,,1163641183391739906,https://twitter.com/lavageul/status/1163641183391739906
2019-08-19 08:06:14,Mikrolet,Henryawan_14,0,1,0,"Begini pendapat Hendrik Udiawan, seorang lulusan Fakultas Ilmu SOSIAL dan Ilmu Politik Universitas Muhammadiyah Malang @UMMcampus https://twitter.com/Henryawan_14/status/1163347925822390272 …",,@UMMcampus,,1163361515459661824,https://twitter.com/Mikrolet/status/1163361515459661824
2019-08-19 07:56:34,innaffff,UMMcampus,0,0,0,"Duh dhinaju bule wkwk",,,,1163359082821984257,https://twitter.com/innaffff/status/1163359082821984257
2019-08-19 06:44:09,masudarmanto,UMMcampus,0,1,0,"Banjar min ai, mun mimin pang apa?",,,,1163340860810883072,https://twitter.com/masudarmanto/status/1163340860810883072
2019-08-19 05:32:00,UMMcampus,,0,1,3,"Bantu Pasarkan Tape Singkong Banjarsari Lewat Medsos | http://www.umm.ac.id/id/berita/bantu-pasarkan-tape-singkong-banjarsari-lewat-medsos.html … | #UMMCampuspic.twitter.com/4GZgXOblg0",,,#UMMCampuspic,1163322701693562880,https://twitter.com/UMMcampus/status/1163322701693562880
2019-08-19 05:20:35,ade_wido,UMMcampus,1,0,0,"Heng ono min, heng masok peno iki",,,,1163319829001990144,https://twitter.com/ade_wido/status/1163319829001990144
2019-08-19 04:49:00,UMMcampus,,3,11,40,"Sumatra hingga Papua tertata Tujuh puluh empat tahun merdeka Beragam bahasa milik kita Bhinneka Tunggal Ika Rayakan peringatan HUT Ke-74 Republik Indonesia lewat keberagaman bahasa yang tersaji di Kaleidoskop Juli 2019. Ada bahasa daerahmu? #ummcampuspic.twitter.com/Wdju0PxrsX",,,#ummcampuspic,1163311881370533888,https://twitter.com/UMMcampus/status/1163311881370533888
2019-08-19 04:26:49,UMMcampus,,0,4,13,"Siap jadi mahasiswa baru UMM? Daftar di http://online.umm.ac.id ya... Yuk kenali dulu jumlah prodi sarjana, magister, dan doktoral di #UMMCampus dan akreditasinya! Selengkapnya, bisa kamu baca di sini http://bit.ly/AkreditasiProdiUMM … yaaa. Cat.: Penghitungan profesi di kolom sarjanapic.twitter.com/hsMVOXEKPU",,,#UMMCampus,1163306299217436672,https://twitter.com/UMMcampus/status/1163306299217436672
2019-08-18 23:50:08,jerseymalang_,,1,6,15,"Wayahe Ospek titip adek2 MABA sak madya, Seng logis & edukatif. Malang pencetak generasi Cerdas bukan penindas. @infomalang @mahasiswamlg @UMMcampus @UB_Official @UINMalikiMalang @unisma193 @polinema_malang @humas_itnmalang",,@infomalang @mahasiswamlg @UMMcampus @UB_Official @UINMalikiMalang @unisma193 @polinema_malang @humas_itnmalang,,1163236668486217728,https://twitter.com/jerseymalang_/status/1163236668486217728
2019-08-18 09:25:57,AcehSelatanSatu,,1,0,0,"35. @UMMcampus Yogyakarta (klaster 2) 36. @unsri (klaster 2) 37. @klik_uad (klaster 2) 38. @UMMcampus Malang (klaster 2) 39. Universitas Sanata Dharma (klaster 2) 40. Universitas Pembangunan Nasional Veteran Jatim (klaster 2) 41. Universitas Pendidikan Ganesha (klaster 2)",,@UMMcampus @unsri @klik_uad @UMMcampus,,1163019192326488065,https://twitter.com/AcehSelatanSatu/status/1163019192326488065
2019-08-17 10:54:09,agusirwanto,kicky_ap,0,0,0,"14 tahun Antimainstream jarene",,,,1162678998448558082,https://twitter.com/agusirwanto/status/1162678998448558082
2019-08-17 04:00:13,nialarasatii_,,0,0,0,"min mau nanya. untuk bebas tanggungan wisuda periode 3 selain di jurusan sama perpus ada lagi apa enggak? makasih @UMMinfo @UMMcampus",,@UMMinfo @UMMcampus,,1162574829209317377,https://twitter.com/nialarasatii_/status/1162574829209317377
2019-08-17 03:47:11,agusirwanto,infomalang,0,0,0,"Aman min, lantai 3 wes dikosongi..",,,,1162571547451650048,https://twitter.com/agusirwanto/status/1162571547451650048
2019-08-17 03:12:55,agusirwanto,uyab_saja,0,0,1,"Lossss langsung, koyok bisul pecah.",,,,1162562925132832769,https://twitter.com/agusirwanto/status/1162562925132832769
2019-08-17 03:11:55,agusirwanto,Yulia_aprlnm,0,0,0,"Tenang, gak nang stadion",,,,1162562673164218370,https://twitter.com/agusirwanto/status/1162562673164218370
2019-08-17 02:56:49,uyab_saja,agusirwanto,1,0,0,"loss gak rewel",,,,1162558872810221571,https://twitter.com/uyab_saja/status/1162558872810221571
2019-08-17 02:40:59,Yulia_aprlnm,agusirwanto,1,0,0,"Awas kenek dendo pssi",,,,1162554887873298438,https://twitter.com/Yulia_aprlnm/status/1162554887873298438
2019-08-17 02:33:42,MalangTramway,,0,2,4,"PT Kereta Api Logistik siap melayani #SobatMalangTramway yg perlu mengirimkan barang lewat angkutan logistik kereta api. Info layanan bisa ditanyakan pada stasiun kereta api setempat https://kereta-api.info/lokasi-kantor-pusat-dan-perwakilan-pt-kereta-api-logistik-kalog-5003.htm … cc @infomalang @mahasiswamlg @UB_Official @UM_1954 @UMMcampus @PuspitaFM",,@infomalang @mahasiswamlg @UB_Official @UM_1954 @UMMcampus @PuspitaFM,#SobatMalangTramway,1162553057512583169,https://twitter.com/MalangTramway/status/1162553057512583169
2019-08-17 02:31:09,infomalang,agusirwanto,1,0,0,"Awas ngeneki koncone..",,,,1162552412843827200,https://twitter.com/infomalang/status/1162552412843827200
2019-08-16 20:45:54,nurudinwriter,aliahsanID,0,0,0,"Beres. Masih ada ospek di sana ramai",,,,1162465529132507136,https://twitter.com/nurudinwriter/status/1162465529132507136
2019-08-16 17:29:09,aliahsanID,nurudinwriter,1,0,0,"Mampir ke ub coffee pak",,,,1162416017470922753,https://twitter.com/aliahsanID/status/1162416017470922753
2019-08-16 14:11:02,adhelilis,idolfess,0,0,0,"Ini mah anak UMM habis UAS @UMMcampus https://twitter.com/idolfess/status/1162364819825033216 …",,@UMMcampus,,1162366160316162049,https://twitter.com/adhelilis/status/1162366160316162049
2019-08-16 11:32:02,mas_indraa,fajarjun,0,0,0,"UMM kampusku @UMMcampus https://twitter.com/fajarjun/status/1162021454507982848 …",,@UMMcampus,,1162326145808793601,https://twitter.com/mas_indraa/status/1162326145808793601
2019-08-16 02:35:56,nurudinwriter,,1,5,12,"Surat edaran tentang akun resmi Medsos kampus UMM. Karena tak sedikit akun2 yang mengatasnamakan UMM tetapi merugikan kampus. @UMMcampus #UMMCampus #umm #kampusumm #jasmerahkampusputihpic.twitter.com/PcF5x93KNE",,@UMMcampus,#UMMCampus #umm #kampusumm #jasmerahkampusputihpic,1162191229955657728,https://twitter.com/nurudinwriter/status/1162191229955657728
2019-08-16 01:01:00,UMMcampus,,0,7,15,"Jombang Minta UMM Lejitkan Potensi Daerahnya | http://www.umm.ac.id/id/berita/jombang-minta-umm-lejitkan-potensi-daerahnya.html … | #UMMCampuspic.twitter.com/1naqdJvm0e",,,#UMMCampuspic,1162167339011338240,https://twitter.com/UMMcampus/status/1162167339011338240
2019-08-15 13:30:56,ade_wido,Hardiansjah_,0,0,0,"Hmmm sepertinyaa",,,,1161993679067701248,https://twitter.com/ade_wido/status/1161993679067701248
2019-08-15 12:15:00,UMMcampus,,0,4,12,"Dosen UMM Gagas Kaderisasi Petani Kopi Berbasis Literasi | http://www.umm.ac.id/id/berita/dosen-umm-gagas-kaderisasi-petani-kopi-berbasis-literasi.html … | #UMMCampuspic.twitter.com/LMFQgWStR0",,,#UMMCampuspic,1161974568933842946,https://twitter.com/UMMcampus/status/1161974568933842946
2019-08-15 11:57:00,UMMcampus,,0,2,3,"BIPA UMM Latih PTN/PTS Pengajaran Bahasa Indonesia untuk Mahasiswa Asing | http://www.umm.ac.id/id/berita/bipa-umm-latih-ptnpts-pengajaran-bahasa-indonesia-untuk-mahasiswa-asing.html … | #UMMCampuspic.twitter.com/Uui2K9frKh",,,#UMMCampuspic,1161970038624129024,https://twitter.com/UMMcampus/status/1161970038624129024
2019-08-15 11:45:00,UMMcampus,,0,2,8,"UMM Siapkan Skema KKN Dampingi TKI di Kinabalu | http://www.umm.ac.id/id/berita/umm-siapkan-skema-kkn-dampingi-tki-di-kinabalu.html … | #UMMCampuspic.twitter.com/Vf5kpx9kuQ",,,#UMMCampuspic,1161967018767032320,https://twitter.com/UMMcampus/status/1161967018767032320
2019-08-15 11:30:00,UMMcampus,,0,2,5,"Lewat Outbond, Mobil Pintar UMM Bikin Dua Sekolah Ini Kompak | http://www.umm.ac.id/id/berita/lewat-outbond-mobil-pintar-umm-bikin-dua-sekolah-ini-kompak.html … | #UMMCampuspic.twitter.com/FSSPRVl6OK",,,#UMMCampuspic,1161963244774281216,https://twitter.com/UMMcampus/status/1161963244774281216
2019-08-15 11:15:00,UMMcampus,,0,2,4,"IKA UMM Gelar Reuni Ruang Rindu | http://www.umm.ac.id/id/berita/ika-umm-gelar-reuni-ruang-rindu.html … | #UMMCampuspic.twitter.com/be5cY74Dl3",,,#UMMCampuspic,1161959469116514308,https://twitter.com/UMMcampus/status/1161959469116514308
2019-08-15 11:13:59,Hardiansjah_,ade_wido,1,0,0,"Saya mengendus bau bau SKM disana. Huhuhu",,,,1161959212844347392,https://twitter.com/Hardiansjah_/status/1161959212844347392
2019-08-15 11:00:02,ade_wido,UMMcampus,1,0,0,"@Hardiansjah_ gimna nih",,@Hardiansjah_,,1161955703247888384,https://twitter.com/ade_wido/status/1161955703247888384
2019-08-15 11:00:01,UMMcampus,,0,2,2,"UMM-Kukar Teken Kerjasama Pendirian Pusat Pendidikan Vokasi | http://www.umm.ac.id/id/berita/ummkukar-teken-kerjasama-pendirian-pusat-pendidikan-vokasi.html … | #UMMCampuspic.twitter.com/TyGoMaX8Nt",,,#UMMCampuspic,1161955698139230208,https://twitter.com/UMMcampus/status/1161955698139230208
2019-08-15 10:46:00,UMMcampus,,0,13,25,"UMM Resmi Buka Prodi Profesi Fisioterapi | http://www.umm.ac.id/id/berita/umm-resmi-buka-prodi-profesi-fisioterapi.html … | #UMMCampuspic.twitter.com/hlEPDGLzZl",,,#UMMCampuspic,1161952170989801472,https://twitter.com/UMMcampus/status/1161952170989801472
2019-08-15 10:36:00,UMMcampus,,1,2,5,"Mobil KaCa di Donomulyo: Dorong Siswa Kuliah hingga Beri Inspirasi Wirausaha lewat Kelas Barista | http://www.umm.ac.id/id/berita/mobil-kaca-di-donomulyo-dorong-siswa-kuliah-hingga-beri-inspirasi-wirausaha-lewat-kelas-barista.html … | #UMMCampuspic.twitter.com/ZSffD89GnB",,,#UMMCampuspic,1161949654390583296,https://twitter.com/UMMcampus/status/1161949654390583296
2019-08-15 10:09:55,UMMcampus,,0,5,7,"Tingkatkan Kualitas, Prodi Ekonomi Syari’ah UMM Raih Akreditasi B | http://www.umm.ac.id/id/berita/tingkatkan-kualitas-prodi-ekonomi-syari …’ah-umm-raih-akreditasi-b.html | #UMMCampuspic.twitter.com/Gq2NYcDsqP",,,#UMMCampuspic,1161943089579081728,https://twitter.com/UMMcampus/status/1161943089579081728
2019-08-15 07:26:06,UMMcampus,,0,0,6,"Spray Anti Nyamuk Alami untuk Cegah Demam Berdarah | http://www.umm.ac.id/id/berita/spray-anti-nyamuk-alami-untuk-cegah-demam-berdarah.html … | #UMMCampuspic.twitter.com/E97y7fFCgd",,,#UMMCampuspic,1161901866155773952,https://twitter.com/UMMcampus/status/1161901866155773952
2019-08-14 00:58:24,malangpostgrup,,0,0,0,"Kenalkan Teh Herbal Rambut Jagung #malangpost @UMMcampus @KKN94UMM @kkn69umm @kkn09umm https://malang-post.com/pendidikan/kenalkan-teh-herbal-rambut-jagung …",,@UMMcampus @KKN94UMM @kkn69umm @kkn09umm,#malangpost,1161441910046654465,https://twitter.com/malangpostgrup/status/1161441910046654465
