text,date,cleaned_tweets
Trs solusi lo apa? Kalo cuma bilang 'ceroboh' doang orang gila juga bisa,2019-07-31 08:49:06,trs solusi lo apa kalo cuma bilang ceroboh doang orang gila bisa
Smg sgr trselesaikan mbk,2019-07-31 08:47:59,smg sgr trselesaikan mbk
DITOLONG HEY DITOLONG @UMMcampus jangan diem diem bae,2019-07-31 08:47:28,hey jangan diem diem bae
cc @mahasiswamlg @infoUB kuy min dibantu sampe anaknya rektor atau siapanya rektor UMM tau ada kasus ini.,2019-07-31 08:47:24,cc kuy min bantu sampe anak rektor siapa rektor umm tau kasus
"Seharusnya masih bisa sih, coba langsung ke dekannya",2019-07-31 08:45:44,masih sih coba langsung dekan
yaAllah semoga ga di do deh ya,2019-07-31 08:45:35,yaallah moga ga do deh
"kalaupun adik ybs ceroboh seharusnya waktu daftar sidang nama dia gak bisa terdeteksi dan gabisa sidang, tapi ini kenapa bisa sampai sidangnya selesai?",2019-07-31 08:42:06,kalaupun adik ybs ceroboh waktu daftar sidang nama gak deteksi gabisa sidang ini bisa sidang selesai
mbak/buk/tente bisa ooen DM? mau sedikit info,2019-07-31 08:41:46,mbakbuktente ooen dm mau sedikit info
"Coba ke LLDIKTI wilayah univ tsb, mbak. Minta bantuan ke mereka.",2019-07-31 08:40:27,coba lldikti wilayah univ tsb mbak minta bantu mereka
"Datangi rektornya aja sekalian, masa hanya masalah administrasi tidak bisa diselesaikan....",2019-07-31 08:39:23,datang rektor aja sekali masa masalah administrasi bisa selesai
Mas dosgon @fajarjun mungkin bisa membantu...,2019-07-31 08:37:57,mas dosgon mungkin bantu
"Semoga bisa terselesaikan, mbk!",2019-07-31 08:36:33,moga selesai mbk
Jadi ini terancam di DO krn belum input skripsi?,2019-07-31 08:35:45,jadi ancam do krn input skripsi
kampusmu ya nis @nisauaiueo,2019-07-31 08:35:01,kampus nis
"seharusnya pihak fakultas bisa turut serta memperjuangkan sampai ke rektorat. Coba hubungi Dekan fakultas, masa dekan fakultas diem aja, atau siapapun yg mempuni di fakultas agar bisa membantu memperjuangkan sampai ke rektorat sampai Pak Rektor tau.",2019-07-31 08:34:23,pihak fakultas turut juang ke rektorat coba hubung dekan fakultas masa dekan fakultas diem aja siapa yg di fakultas bisa bantu juang ke rektorat pak rektor tau
Gara2 apa mbak masalah pokoknya? Soalnya temen saya mirip2 gitu. Jadi ada nilai D ANGKATAN 2012 sama. Peraturan sekrng g boleh ada nilai D. akhirnya lobby kesana kemari. Ketemu dosen mata kuliah itu dikasih. Tugas agar bisa lulus..,2019-07-31 08:32:59,gara apa mbak masalah pokok soal temen mirip gitu jadi nilai d angkat sama atur sekrng g ada nilai d akhir lobby kesana kemari ketemu dosen mata kuliah kasih tugas bisa lulus
"Mudah2an ada jalan keluar, jgn sampe aja malah jd dilaporin pencemaran nama baik kayak yg lagi viral...",2019-07-31 08:31:07,mudah jalan keluar jgn sampe aja malah jd dilaporin cemar nama baik kayak yg viral
"Aah.. begitu ya. Semoga saja dari pihak kampus masih ada jalan keluar lainnya ya kak. Sayang, sudah hampir selesai. Semoga masih ada jalan, yang penting adek dan keluarga kakak sudah berusaha.",2019-07-31 08:31:03,aah ya moga dari pihak kampus ada jalan keluar ya kak sayang hampir selesai moga ada jalan penting adek keluarga kakak usaha
Biasanya pada sampe smt banyak baru lulus ya?,2019-07-31 08:30:25,biasa sampe smt banyak baru lulus
"Iya betul, sudah saya reply di tweet selanjutnya mas",2019-07-31 08:29:02,iya betul saya reply tweet lanjut mas
"Iya nih si adek dulu di tengah2 sempat kehilangan semangat. Amin, makasih yaa.",2019-07-31 08:26:37,iya nih si adek dulu tengah sempat hilang semangat amin makasih yaa
"Yang sabar ya mbak, semoga diberikan titik cerah dari masalah ini:)",2019-07-31 08:25:27,sabar mbak moga beri titik cerah masalah
Kan berat,2019-07-31 08:24:33,kan berat
it ya gitu. . sedap,2019-07-31 08:24:13,it gitu sedap
"Moga nggak sia sia ya mba. Masalahnya adalah : kalo misalkan menristek ngasih izin, pihak kampus harusnya bisa jalan dan ngubah itu ini kok malah D.O Ya Allah, semoga adeknya wisuda ya mba",2019-07-31 08:24:08,moga sia sia mba masalah kalo misal menristek ngasih izin pihak kampus bisa jalan ngubah ini kok malah do allah moga adeknya wisuda mba
@Kemdikbud_RI yuk difasilitasi daripada terjadi kesalahpahaman Netizen yg malah jadi tuntutan hukum. Moso D.O ?,2019-07-31 08:23:53,yuk fasilitas jadi kesalahpahaman netizen yg malah jadi tuntut hukum moso do
Udh semester mentok boss itu 14 ga bisa nambah,2019-07-31 08:23:48,udh semester mentok boss ga nambah
Gausah nanya segala udah jelas kali yakan :),2019-07-31 08:23:38,gausah nanya segala udah jelas kali yakan
Beda ya emang kak?,2019-07-31 08:23:28,beda emang kak
Padahal Ristekdikti udah ngizinin pihak kampus buat ngajuin perubahan data. Kalau masalah administrasi sih keterlaluan,2019-07-31 08:23:24,padahal ristekdikti udah ngizinin pihak kampus buat ngajuin ubah data kalau masalah administrasi sih terlalu
"Temen gw jg gtu kmrn, udah bayar tapi TA nya ga dikpntrak",2019-07-31 08:22:51,temen gw jg gtu kmrn udah bayar ta nya ga dikpntrak
"@UMMcampus tolong d bantu lah ini, seribet apapun, harusnya bisa d usahakan..",2019-07-31 08:22:41,d bantu lah seribet apa bisa d usaha
Wah nggak paham juga Kak :( Intinya karena ada khilaf administrasi itu jadi yaudah bye,2019-07-31 08:22:13,wah paham kak inti ada khilaf administrasi jadi yaudah bye
baca gih @aquaseleraku,2019-07-31 08:20:34,baca gih
"Gimana yaa UMM ini, Ristekdikti udah ngizinin pihak kampus buat ngajuin perubahan data, tapi kok malah terancam drop out?",2019-07-31 08:20:10,gimana yaa umm ristekdikti udah ngizinin pihak kampus buat ngajuin ubah data kok malah ancam drop out
"Giliran soal ginian aja, lancar. Ipk apakabar smt ini? Wkwkw",2019-07-31 08:19:42,gilir soal ginian aja lancar ipk apakabar smt wkwkw
"Pas baca ""busettt 14 semester"" pas liat fotonya ternyata Teknik Informatika, wajar. Semoga bisa diperjuangkan mba",2019-07-31 08:19:41,pas baca busettt semester pas liat foto nyata teknik informatika wajar moga juang mba
"Sabar woe, masih baca wkwmwm",2019-07-31 08:19:10,sabar woe baca wkwmwm
"Oh iya sama"" :)",2019-07-31 08:16:27,iya sama
"Tapi masalahnya sudah semester terakhir ya . Mohon kebijakan kampus saja kak, mungkin bisa dicarikan jalan keluar lagi. Semoga segera mendapat jalan keluar ya kak .",2019-07-31 08:14:35,masalah semester akhir mohon bijak kampus kak mungkin cari jalan keluar moga segera jalan keluar kak
"Sudah diajukan opsi itu juga kepada kampus, tapi kampus menolak, Kak. 14 semester fix kudu beres, terlepas sudah beres sidang skripsi",2019-07-31 08:14:16,aju opsi juga kampus kampus tolak kak semester fix kudu beres lepas beres sidang skripsi
@Satourdate inikah?,2019-07-31 08:13:59,
Jadi akhirnya dia menambah 1 semester hanya utk menambah 1 SKS mata kuliah yang kurang dan baru sidang. Tidak sampai drop out. Coba didiskusikan terlebih dahulu dengan pihak kampus.,2019-07-31 08:12:44,jadi akhir tambah semester utk tambah sks mata kuliah kurang baru sidang sampai drop out coba diskusi lebih dengan pihak kampus
"Hai kak, apa tidak bisa didiskusikan untuk menginput skripsi pada semester ini? Namun tidak perlu untuk mengulang skripsinya? Dulu pernah ada teman di PTN, karena sempat terjadi perubahan kurikulum ternyata kredit SKS nya kurang 1 SKS, padahal dia juga sudah siap sidang.",2019-07-31 08:11:05,hai kak apa bisa diskusi menginput skripsi semester namun perlu ulang skripsi dulu pernah teman ptn sempat jadi ubah kurikulum nyata kredit sks nya kurang sks padahal juga siap sidang
"Nggak ngerti juga gimana kebijakan @UMMcampus, yang pasti setelah mencoba ngurus2 dari 22 Juli sampai hari ini, dari kampus menyatakan adikku tidak bisa dibantu untuk lulus di sana.",2019-07-31 07:53:23,ngerti gimana bijak pasti coba ngurus juli hari dari kampus nyata adik bisa bantu lulus sana
"setiap kampus harusnya ada dispensai dr pihak birokrasi, terlebih kakak nya udh sidang skripsi.",2019-07-31 07:50:48,tiap kampus ada dispensai dr pihak birokrasi lebih kakak nya udh sidang skripsi
Wah nak umm wkwk,2019-07-31 03:13:23,wah nak umm wkwk
"Ngapain ke Ristek ? Coba ngadu ke Majelis Dikti PP Muhammadiyah, lembaga ini yg mengeluarkan SK Rektor Perguruan Tinggi Muhammadiyah seluruh Indonesia.",2019-07-30 07:52:21,ngapain ristek coba ngadu majelis dikti pp muhammadiyah lembaga yg keluar sk rektor guru tinggi muhammadiyah seluruh indonesia
Sosialisasi narkotika mahasiswa KKN 85 @UMMcampus pic.twitter.com/2CJDozzB1o,2019-07-30 04:56:59,sosialisasi narkotika mahasiswa kkn
Hajar terus hajar sol. Jangan kasih kendor,2019-07-30 01:25:08,hajar terus hajar sol jangan kasih kendor
Hidup kkn,2019-07-30 00:14:02,hidup kkn
Iya mbak semorning inichh,2019-07-29 22:44:18,iya mbak semorning inichh
"@UMMcampus Pengumuman untuk adek-adek maba, guest star kita tahun ini adalah..... pic.twitter.com/VKZxks1Qms",2019-07-29 06:05:26,umum adekadek maba guest star tahun adalah
[PENGUMUMAN] Untuk peserta Penerimaan Mahasiswa Baru (PMB) Universitas Muhammadiyah Malang (UMM) Jalur Reguler Gelombang II yang diterima Registrasi diperpanjang pada 28 Juli - 14 Agustus 2019 Informasi lebih lanjut klik http://infobaa.umm.ac.id #ummcampuspic.twitter.com/S9sFthJQsc,2019-07-29 02:57:41,umum serta terima mahasiswa baru pmb universitas muhammadiyah malang umm jalur reguler gelombang ii terima registrasi panjang juli agustus informasi lebih lanjut klik
"#info #dondar #Malang | 28 Juli 2019 | 06.00 wib-selesai | Hari Koperasi Depo Belanegara, Malang | @pddi_malang cc @BFLMalang @UMMcampus @infomalangPLUS @SamMalang_ #YukDonorBareng #YukDonorDarah",2019-07-28 00:54:32,juli wibselesai hari koperasi depo belanegara malang cc
"Tak turu sik. Mengko nek wis gelem mutualan, ngabari ya!",2019-07-27 16:39:21,tak turu sik mengko nek wis gelem mutualan ngabari
Woh jebulé Warga Berkemajuan Lhuuurr.. @UMMcampus @B_BayuAji @trah_fitrah @panca_negara / @kinkadwirasti ig: http://instagram.com/kinkadwii https://twitter.com/TommyArd_/status/1154430623571779586 …pic.twitter.com/fTHHSykXnf,2019-07-27 15:37:11,woh jebul warga maju lhuuurr ig
ngambil yg sedikit peminat biar peluang dapetin hati dosen semakin besar,2019-07-27 14:19:17,ngambil yg sedikit minat biar peluang dapetin hati dosen makin besar
akhirnya saya menjadi mahasiswa setengah tua tapi masih gemesh. ini sisa sks gabisa diganti jadi duit? cc : @UMMcampus pic.twitter.com/Rgrfp16rgQ,2019-07-27 14:13:37,akhir jadi mahasiswa tengah tua masih gemesh sisa sks gabisa ganti jadi duit cc
"Penting dong, acara ini menyangkut kehidupan bangsa dan negara",2019-07-26 10:45:45,penting dong acara sangkut hidup bangsa negara
Acara apa.. Penting gak?,2019-07-26 10:37:47,acara apa penting gak
Besok ikut ke acaranya gus @RifatBazein mas?,2019-07-26 10:27:03,besok ikut acara gus mas
Wenakkk...,2019-07-26 10:01:12,wenakkk
"Min, maaf mau tanya lagi. Ini masnya foto di gedung bagian mana? Mau ikutan:"") @UMMcampus #MGMAVOTE #EXO @weareoneEXOpic.twitter.com/3cRZN3JC18",2019-07-26 09:24:43,min maaf mau tanya ini mas foto gedung mana mau ikut
Penyerahan SK Pendirian Program Studi Profesi Fisioterapi oleh LLDikti kepada Universitas Muhammadiyah Malang . . @ummcampus fikes_umm @Universitas Muhammadiyah Malang https://www.instagram.com/p/B0X9WE3HOLR/?igshid=1dqjqbgok6vbh …,2019-07-26 09:07:22,serah sk diri program studi profesi fisioterapi lldikti universitas muhammadiyah malang fikesumm muhammadiyah malang
"Disaat harapan sudah pudar, hanya kepadaNya lah jiwa ini dikembalikan Masjid Ar Fachruddin @UMMcampus pic.twitter.com/iwHuPEwTMl",2019-07-26 08:50:18,harap pudar kepada lah jiwa kembali masjid ar fachruddin
"@UMMcampus Min mau tanya, info keuangan di Aplikasi MyUMM kok beda sama di Infokhs ?",2019-07-26 04:23:08,min mau tanya info uang aplikasi myumm kok beda sama infokhs
"Gak usah jauh ke Bromo, cukup di @UMMcampus sja. pic.twitter.com/5KGFkpf6NB",2019-07-25 22:58:41,gak usah jauh bromo cukup sja
[KKN 10 UMM JAMBESARI 2019 PROUDLY PRESENT] TEMU ONTHEL MALANG RAYA mahasiswa KKN 10 UMM JAMBESARI 2019 dalam rangka menyambut HUT RI KE 74 dan memperkenalkan wisata Embung Jambesari Sunset di Desa Jambesari. @infomalang @UMMcampus @radar_malang @934UMMfm @KabarMLGpic.twitter.com/Nm1ByQUtNU,2019-07-25 12:18:45,kkn umm jambesari proudly present temu onthel malang raya mahasiswa kkn umm jambesari rangka sambut hut ri dan kenal wisata embung jambesari sunset desa jambesari
Itu bercermin ato gimana kid?,2019-07-24 08:32:32,cermin ato gimana kid
"Ah kuliah 3,5 thn mana bisa nyamain kuliatas kampus ui ?? 7 tahun noh lulus kuliatas Oxford university",2019-07-24 06:31:21,ah kuliah thn mana nyamain kuliatas kampus ui tahun noh lulus kuliatas oxford university
"Wah selamat dek, selamat bergabung di ITP, kita satu jurusan dek",2019-07-24 06:27:26,wah selamat dek selamat gabung itp satu jurus dek
Btw ini kating jurusan apasih beh? Kok kita pas kuliah dulu ngga nemu yang begini @Fara_Frs sapa tau salah dua nya jodoh kita.,2019-07-23 11:53:50,btw kating jurus apasih beh kok pas kuliah dulu ngga nemu begini sapa tau salah nya jodoh
Alhamdulillah bisa masuk @UMMcampus jazakumullah khoir... Suatu kebanggaan banget bsa masuk @UMMcampus Dan masuk fakultas @BEMFPPUMM :')pic.twitter.com/PDjSNHpzOo,2019-07-22 13:11:18,alhamdulillah masuk jazakumullah khoir suatu bangga banget bsa masuk masuk fakultas
"Ayah, ibu, aku lulusan umm adek skrg keterima masuk umm Uuuuhh We love @UMMcampus",2019-07-22 02:30:31,ayah ibu aku lulus umm adek skrg terima masuk umm uuuuhh we love
Cepet ya kalo ginian responnya,2019-07-21 08:06:14,cepet kalo ginian responnya
Itu ada cowonya mimi peri...,2019-07-20 08:41:29,ada cowonya mimi peri
weee jadi pengen masuk UMM kalo katingnya model gini,2019-07-20 04:16:50,weee jadi ken masuk umm kalo katingnya model gin
"Kalo iyee ada yanh kayak baekhyun, rela pindah kampus gueee",2019-07-20 02:44:38,kalo iyee yanh kayak baekhyun rela pindah kampus gueee
Tolong @hikmamchtr,2019-07-19 18:05:02,
@aplutodust @pepeskadal di umm nih gais,2019-07-19 16:35:31,umm nih gais
Wadaawwww.. kalo bgini mau aku kuliah lagi,2019-07-19 16:33:23,wadaawwww kalo bgini mau aku kuliah
Loalah angkatanku ko gaonok rek minggu ae ngampus aku lek onok arek kyk ngene.,2019-07-19 15:23:48,loalah angkat ko gaonok rek minggu ae ngampus aku lek onok arek kyk ngene
@rongrongput katingmu mbak? Wkwk,2019-07-19 15:14:19,katingmu mbak wkwk
"almet kedodoran gitu aja cakep, pakabar kiteee :(",2019-07-19 13:40:18,almet kedodoran gitu aja cakep pakabar kiteee
"Ini kating UMM yg tadi siang aku share kan yak? Mereka lagi ngampus ges, mereka gak bolos kok :v @UMMcampus #MGMAVOTE #EXO @weareoneEXOpic.twitter.com/oqDnjNoU5x",2019-07-19 12:19:14,kating umm yg tadi siang aku share kan yak lagi ngampus ges gak bolos kok v
Kalau kek gini auto lulusnya bareng aja meskipun lama gakpapa :'),2019-07-19 11:46:53,kalau kek gin auto lulus bareng aja meski lama gakpapa
Hahaha iyaa wehh baru aku mau mention km begituan,2019-07-19 11:35:24,hahaha iyaa wehh baru aku mau mention km
Trus yg datang beda 180° waaa kecewa netijen,2019-07-19 11:34:29,trus yg datang beda waaa kecewa netijen
@lvniaypw mahasiswa baru UMM,2019-07-19 10:39:45,mahasiswa baru umm
Iya poster open recruitment buat pesmaba nanti itu mal,2019-07-19 10:26:30,iya poster open recruitment buat pesmaba itu mal
Foto pas mau ngisi safari pesmaba itu,2019-07-19 10:25:47,foto pas mau ngisi safari pesmaba
@UMMcampus untuk pembayaran SPP lewat BNI apa masih bermasalah?,2019-07-19 10:23:40,bayar spp lewat bni apa masalah
YaAlloh typo maba makstku,2019-07-19 09:16:16,yaalloh typo maba makstku
Wehh Mana fpp,2019-07-19 09:15:10,wehh mana fpp
Lohhh iyaaa taaa ?? wkwkkw,2019-07-19 08:02:48,lohhh iyaaa taaa wkwkkw
Yang rambut putih cowonya @khymn_ jangan macem2 klean. :)),2019-07-19 07:51:37,rambut putih cowonya jangan macem klean
yaaa dulu barengan pas ngulang mata kuliah gara2 mereka sering absen kuliah dgn alasan klasik: manggung.,2019-07-19 07:04:13,yaaa dulu bareng pas ngulang mata kuliah gara sering absen kuliah dgn alas klasik manggung
Ikhlas aku tu dipaido ikhlas ((:,2019-07-19 06:44:04,ikhlas aku tu dipaido ikhlas
Lah kok? ((':,2019-07-19 06:37:58,lah kok
LAGI PMS,2019-07-19 06:36:14,pms
Lah kok anda ngegas mas )):,2019-07-19 06:35:02,lah kok ngegas mas
@klgdxxx kating neh(?),2019-07-19 06:00:44,kating neh
Mbanya bikin ngakak Mungkin mereka masuk setelah mbanya udah lulus :v,2019-07-19 05:41:19,mbanya bikin ngakak mungkin masuk mbanya udah lulus v
Hahaha ayo wes cus.. opo nang kantin asri wae sejuk.. tapi awakdewe mlakune adoh,2019-07-19 05:32:13,hahaha ayo wes cus opo nang kantin asri wae sejuk awakdewe mlakune adoh
"Yuhh, goleki mereka jurusan opo, parani nang kelas e, ajak ngopi nang 3.5 (eh mbuh ini masih ada apa enggak",2019-07-19 05:30:16,yuhh golek jurus opo paran nang kelas e ajak ngopi nang eh mbuh masih apa enggak
Wkwkwk,2019-07-19 05:24:28,wkwkwk
Lapo angkatanku biyen ga ono seng modelane ngene,2019-07-19 05:21:59,lapo angkat biyen ga ono seng modelane ngene
Ya allah reinkarnasi kuu,2019-07-19 05:19:57,allah reinkarnasi kuu
EEEEEEEE MAMPOOOSSS AYO KULIAH MANEH,2019-07-19 05:11:56,eeeeeeee mampooosss ayo kuliah maneh
Ngahahaha jadi pen kulyah maneh piye mak @keyEkaria,2019-07-19 05:10:56,ngahahaha jadi pen kulyah maneh piye mak
seger kalik ya kalo ada beginian wkwk,2019-07-19 04:53:08,seger kalik kalo begini wkwk
ealah....ndisik gak onok rek.....,2019-07-19 04:41:52,ealahndisik gak onok rek
Pacarku iku min :v,2019-07-19 04:07:38,pacar iku min v
"Mon maap dia kating UMM bukan? Wahai anak UMM mintain nomer wassapnya dong pliss:"") @UMMcampus #MGMAVOTE #EXO @weareoneEXOpic.twitter.com/iVvC141v8r",2019-07-19 02:58:51,mon maap kating umm bukan wahai anak umm mintain nomer wassapnya dong pliss
Tonggoku wi,2019-07-19 02:54:37,tonggoku wi
"Mon maap cuman nanya. Adakah yg di UMM? Ini kating kalian bukan? Minta no wassapnya dong:"") @UMMcampus #MGMAVOTE #EXO @weareoneEXOpic.twitter.com/k2KZ0Ed4gU",2019-07-19 00:22:21,mon maap cuman nanya yg umm kating kalian bukan minta no wassapnya dong
TVC Terbaru UMM 2019 niiiiiih!!!. . Pendaftarannya Gel III UMM sudah dibuka mulai 15 Juli - 22 Agustus 2019. Segera chek di http://umm.ac.id Reposted from @ummcampus https://www.instagram.com/p/B0DvKgfFSh0/?igshid=xpyqz8us33xy …,2019-07-18 12:38:55,tvc baru umm niiiiiih daftar gel iii umm buka mulai juli agustus segera chek reposted from
TVC Terbaru UMM 2019 niiiiiih!!!. . Pendaftarannya Gel III UMM sudah dibuka mulai 15 Juli - 22 Agustus 2019. Segera chek di http://umm.ac.id Reposted from @ummcampus https://www.instagram.com/p/B0Du01ulc6R/?igshid=1s3med4dnr2i0 …,2019-07-18 12:36:11,tvc baru umm niiiiiih daftar gel iii umm buka mulai juli agustus segera chek reposted from
Nanti dikira ikut-ikutan,2019-07-18 04:54:31,kira ikutikutan
Terima kasih supportnya Kak,2019-07-17 10:45:18,terima kasih supportnya kak
"Min, gelar lulusan S1 ilmu komunikasi yg bener apa ya ? S.Kom, S.ikom atau S.I.Kom ? Thank you min Urgent !!! @UMMcampus",2019-07-17 09:43:54,min gelar lulus s ilmu komunikasi yg bener apa skom sikom sikom thank you min urgent
"Sinergi Kebangsaan, INTI-UMM Teken Kerja Sama | http://www.umm.ac.id/id/berita/sinergi-kebangsaan-intiumm-teken-kerja-sama.html … | #UMMCampuspic.twitter.com/q5Lz6xnUSe",2019-07-17 04:07:00,sinergi bangsa intiumm teken kerja sama
Kata Pakar Amerika tentang Empat Faktor yang Buat Teroris 'Pensiun' | http://www.umm.ac.id/id/berita/kata-pakar-amerika-tentang-empat-faktor-yang-buat-teroris-pensiun.html … | #UMMCampuspic.twitter.com/Fi6K7zbxdx,2019-07-17 03:06:00,kata pakar amerika empat faktor buat teroris pensiun
Asisten lab komputasi LKEB @UMMcampus Angkatan 2014 pic.twitter.com/r10tIAHJ09,2019-07-16 22:20:08,asisten lab komputasi lkeb angkat
@UMMcampus min mau nanya klo jurusan manajemen itu kampus berapa ?,2019-07-16 14:19:22,min mau nanya klo jurus manajemen kampus berapa
"yadong, langsung internasional",2019-07-16 12:27:21,yadong langsung internasional
mahal keknya promosinya ini wkwkwkw,2019-07-16 12:07:16,mahal kek promosi wkwkwkw
"Mobil KaCa UMM di PSPA Bima Sakti: Adakan Outbond, Kelas Jurnalistik sampai Fotografi | http://www.umm.ac.id/id/berita/mobil-kaca-umm-di-pspa-bima-sakti-adakan-outbond-kelas-jurnalistik-sampai-fotografi.html … | #UMMCampuspic.twitter.com/H8OSEinkPc",2019-07-16 12:04:00,mobil kaca umm pspa bima sakti adakan outbond kelas jurnalistik fotografi
Ayas di negara tumpang lur,2019-07-16 11:32:55,ayas negara tumpang lur
"Songsong Pimnas, UMM Jadi Tuan Rumah Monev PKM | http://www.umm.ac.id/id/berita/songsong-pimnas-umm-jadi-tuan-rumah-monev-pkm.html … | #UMMCampuspic.twitter.com/KGxPHtXowg",2019-07-16 11:04:00,songsong pimnas umm jadi tuan rumah monev pkm
Saat Mahasiswa Asing Juga Ikut KKN | http://www.umm.ac.id/id/berita/saat-mahasiswa-asing-juga-ikut-kkn.html … | #UMMCampuspic.twitter.com/QkXEB0h5Wd,2019-07-16 10:42:55,mahasiswa asing ikut kkn
"bukan editan, logo @UMMcampus emang ada di vlognya Will Smith, promosi gratis, tapi munculnya cuma sedetik pic.twitter.com/g81OfBpDfM",2019-07-16 09:47:07,bukan edit logo emang di vlognya will smith promosi gratis muncul cuma detik
Butuh temen kontrak cewek nih. Sisa 1 kamar. Daerah suhat 3 menit dari polinema dan UB. Murah abis kak! Info 085745111955. Kamsia @mahasiswamlg @InfoPolinema @UB_Official @InfoUnisma @UMMcampus,2019-07-16 08:32:51,butuh temen kontrak cewek nih sisa kamar daerah suhat menit polinema ub murah abis kak info kamsia
Selamat Universitas Muhammadiyah Mendunia @UMMcampus https://twitter.com/UMMcampus/status/1150700282474426368 …,2019-07-15 11:28:36,selamat universitas muhammadiyah dunia
Mosok kalah karo @UMMcampus sing parkir e gratis,2019-07-15 10:33:32,mosok kalah karo sing parkir e gratis
"Akrab dengan pepatah “Tuntutlah Ilmu sampai ke Negeri Cina”? Kini, civitas akademika #UMMCampus bisa mewujudkannya dengan Guangxi Normal University. Simak selengkapnya di video berikut ini! Full report, click here http://bit.ly/UMMdanGuangxi pic.twitter.com/rIFJq0gKZZ",2019-07-15 09:35:00,akrab pepatah tuntut ilmu ke negeri cina kini civitas akademika wujud guangxi normal university simak lengkap video ikut full report click here
Halo min @UMMcampus nanya untuk lowongan dosen UMM dibuka apa saja ya? Dikirimkan kemana berkasnya? http://bau.umm.ac.id/id/pages/lamaran-kerja-di-umm.html …,2019-07-15 08:59:12,halo min nanya lowong dosen umm buka apa ya kirim mana berkas
"@UMMcampus min mau nanya, lowongan dosen UMM buka prodi apa ya? Syarat bisa dikirimkan kemana ya? http://bau.umm.ac.id/id/pages/lamaran-kerja-di-umm.html …",2019-07-15 08:54:39,min mau nanya lowong dosen umm buka prodi apa syarat kirim mana
BIPA UMM Latih Mahasiswa Asing Jadi Duta Budaya dan Bahasa Indonesia | http://www.umm.ac.id/id/berita/bipa-umm-latih-mahasiswa-asing-jadi-duta-budaya-dan-bahasa-indonesia.html … | #UMMCampuspic.twitter.com/f7I6nY7hgU,2019-07-14 01:29:00,bipa umm latih mahasiswa asing jadi duta budaya bahasa indonesia
Bupati Pekalongan dan UMPP Belajar Kelola PT Ke UMM | http://www.umm.ac.id/id/berita/bupati-pekalongan-dan-umpp-belajar-kelola-pt-ke-umm.html … | #UMMCampuspic.twitter.com/jOowYm2WaP,2019-07-13 11:28:00,bupati kalong umpp ajar kelola pt umm
Cegah Anak Antisosial dengan Berpetualang dan Berkebun | http://www.umm.ac.id/id/berita/cegah-anak-antisosial-dengan-berpetualang-dan-berkebun.html … | #UMMCampuspic.twitter.com/7V4DFqnui7,2019-07-13 09:54:00,cegah anak antisosial tualang kebun
BAPOMI Jatim Beri Mandat ke UMM Helat Pomda Futsal | http://www.umm.ac.id/id/berita/bapomi-jatim-beri-mandat-ke-umm-helat-pomda-futsal.html … | #UMMCampuspic.twitter.com/7kpJyx022U,2019-07-13 08:49:00,bapomi jatim beri mandat umm helat pomda futsal
UMM Terjunkan Mahasiswa KKN di 6 Negara | http://www.umm.ac.id/id/berita/umm-terjunkan-mahasiswa-kkn-di-6-negara.html … | #UMMCampuspic.twitter.com/Hs05TI5z6B,2019-07-13 07:45:00,umm terjun mahasiswa kkn negara
IKA UMM Kaltim Terima Hibah Tanah untuk Dirikan Politeknik Milenia | http://www.umm.ac.id/id/berita/ika-umm-kaltim-terima-hibah-tanah-untuk-dirikan-politeknik-milenia.html … | #UMMCampuspic.twitter.com/d2HHQ6KUZh,2019-07-13 06:37:00,ika umm kaltim terima hibah tanah diri politeknik milenia
Waduh aku harap-harap cemas,2019-07-13 05:43:28,waduh aku harapharap cemas
Seratus Lulusan UMM Dicetak Jadi Digipreneur | http://www.umm.ac.id/id/berita/seratus-lulusan-umm-dicetak-jadi-digipreneur.html … | #UMMCampuspic.twitter.com/cXi59LQ2c4,2019-07-13 05:33:00,ratus lulus umm cetak jadi digipreneur
Pasti lagi harap-harap cemas ya buat ujian hari hari Senin depan? Persiapkan dirimu sebaik mungkin ya! Perhatikan juga hal-hal berikut ya agar persiapanmu semakin mantap dan semangat menghadapi ujian. #UMMCampuspic.twitter.com/KBOh9G9KIk,2019-07-13 05:19:57,lagi harapharap cemas buat uji hari hari senin depan siap diri baik mungkin perhati halhal ikut agar siap makin mantap semangat hadap uji
"Langganan Juara Nasional, Bikin Nazar Sisihkan Separuh Hadiah Buat Sedekah | http://www.umm.ac.id/id/berita/langganan-juara-nasional-bikin-nazar-sisihkan-separuh-hadiah-buat-sedekah.html … | #UMMCampuspic.twitter.com/e9WfQr0Krk",2019-07-13 05:05:45,langgan juara nasional bikin nazar sisih paruh hadiah buat sedekah
Hhha\hhahaa,2019-07-13 03:51:58,hhhahhahaa
Bulan Syawal identik dengan banyak banget undangan pernikahan yang nangkring di meja kantor juga berupa undangan digital. Seperti Kaleidoskop Juni 2019 berikut ini. Yuk flashback ke kegiatan bulan Juni! #UMMCampushttps://youtu.be/A8qEDrFIPD4,2019-07-12 12:16:56,bulan syawal identik banyak banget undang nikah nangkring meja kantor upa undang digital kaleidoskop juni ikut yuk flashback giat bulan juni
