text,date,cleaned_tweets
"Bukan UMM saja hampir semua universitas umumnya seperti itu, apalagi negeri. Harusnya tdk sampai ke media sosial apalagi media massa nasional. Saya yakin jk dilakukan komunikasi yg intens dgn para pihak universitas pasti diberikan jalan keluar. Smg masalahnya cepat terselesaikan.",2019-08-01 04:30:37,bukan umm hampir semua universitas umum itu negeri tdk ke media sosial media massa nasional yakin jk laku komunikasi yg intens dgn pihak universitas beri jalan keluar smg masalah cepat selesai
"Apakah gak ada perpanjangan 1 semester lgi? Maksimal kan 15 semester, asal kaprodi mau mengurus perpanjangan semester",2019-08-01 04:26:16,gak panjang semester lgi maksimal kan semester asal kaprodi mau urus panjang semester
"Logikanya terbalik, yg kesalahan administrasi mahasiswa yg bersangkutan kok yg ditindak tegas kampusnya. Aneh.",2019-08-01 04:23:10,logika balik yg salah administrasi mahasiswa yg sangkut kok yg tindak tegas kampus aneh
"Honestly, saya ikut berharap ada keajaiban, mbak.",2019-08-01 04:17:44,honestly ikut harap ajaib mbak
Udah ada beritanya di sinihttps://infosurabaya.id/2019/08/01/umm-sesalkan-cuitan-kakak-mahasiswa-yang-terancam-do-gara-gara-administrasi/ …,2019-08-01 04:17:15,udah berita sinihttps
"Kalau dibandingkan UMM kampus saya kecil aja mbak, tapi semoga UMM bisa mencontoh kampus saya, jika seorang mahasiswa statusnya di virtual belum aktif, belum bisa ikut kegiatan perkuliahan termasuk skripsi, semangat mbaknya dan adiknyaa",2019-08-01 04:17:11,kalau banding umm kampus kecil aja mbak moga umm contoh kampus jika orang mahasiswa status virtual aktif bisa ikut giat kuliah masuk skripsi semangat mbak adiknyaa
"Sudah ke semua level pejabat kampus, Mas. Masalah administrasi ini tidak bisa dibantu, katanya",2019-08-01 04:14:25,ke semua level jabat kampus mas masalah administrasi tidak bantu kata
"Omg, emoga cpt selesai permasalahannya mba :(",2019-08-01 04:13:34,omg emoga cpt selesai masalah mba
tapi sistem berubah terus tiap semester lho Mas mahasiswanya mumet wkwk,2019-08-01 04:13:24,sistem ubah terus tiap semester lho mas mahasiswa mumet wkwk
"Mbakk semoga bisa tetap wisuda yaa, kalau kampus saya jika di virtual belum krsan tidak bisa ikut kegiatan perkuliahan sama sekali jadi langsung ketahuan jika statusnya belum aktif, dan jika sudah bayar otomatis statusmya aktif kuliah dan bisa krsan",2019-08-01 04:12:45,mbakk moga tetap wisuda yaa kalau kampus virtual krsan bisa ikut giat kuliah sama sekali jadi langsung tahu jika status aktif jika bayar otomatis statusmya aktif kuliah bisa krsan
Oiyo suwun suwun,2019-08-01 04:12:37,oiyo suwun suwun
Andai saja budaya positifnya ini bisa gampang dicopas di kampus2 lainnya.,2019-08-01 04:11:35,andai budaya positif bisa gampang dicopas kampus
"Memang secara kelembagaan, Elektro UGM mah selain keren kerja administrasinya, dosen2nya solutif, juga orang2nya akomodatif mau bantuin mahasiswa2 yg memang kesulitan. Jurusan2 lain belum tentu.",2019-08-01 04:10:02,memang cara lembaga elektro ugm mah keren kerja administrasi dosen solutif orang akomodatif mau bantuin mahasiswa yg memang sulit jurus belum
"Wah sayang sekali ya! Seharusnya bisa memaksimalkan Aplikasi ""My Parents"" dari kampus dicek disini ya (https://play.google.com/store/apps/details?id=id.ac.umm.myummparent …) Disitu pengecekan segala administrasi dan perkembangan akademik bisa dilakukan ortu lo hehe. Blm lg harusnya melakukan pengecekan rutin di infokhs umm",2019-08-01 04:09:07,wah sayang sekali maksimal aplikasi my parents kampus cek sini situ kece segala administrasi kembang akademik laku ortu lo hehe blm lg harus laku kece rutin infokhs umm
Waah syg sekali. Seharusnya bs memaksimalkan fungsi aplikasi Andorid MyUMM for Students yg bnr2 mempermudah. Jd bisa ngecek secara berkala berbagai kepentingan administrasi. Orang tua pun bisa melihat prkmbngn akademik anaknya melalui MyUMM Parent. https://play.google.com/store/apps/details?id=id.ac.umm.myummparent …,2019-08-01 04:04:10,waah syg sekali bs maksimal fungsi aplikasi andorid myumm for students yg bnr mudah jd ngecek cara kala bagai penting administrasi orang tua bisa lihat prkmbngn akademik anak lalu myumm parent
Bingung nya kok bisa ikut sidang saat di KRS gada SKS Skripsi Ini sekjur sama dosen pembimbing dan penguji ngak ngecek KRS apa ya,2019-08-01 03:56:02,bingung nya kok ikut sidang di krs gada sks skripsi sekjur sama dosen bimbing uji ngak ngecek krs apa
"Biasanya, injury time memang diberi diskresi khusus, termasuk soal administrasi. ini murni kelalaian saja, mahasiswa dan dosen sama-sama tidak tahu.",2019-08-01 03:55:33,biasa injury time memang beri diskresi khusus masuk soal administrasi murni lalai mahasiswa dosen samasama tahu
"Selain ke kaprodi, coba komunikasikan ke Fakultas dan direktorat pendidikan dan pengajaran (akademik) Universitas, karena mereka-lah yang dapat membuka tutup sistem berdasarkan diskresi dari Departemen.",2019-08-01 03:53:54,kaprodi coba komunikasi ke fakultas direktorat didik ajar akademik universitas mereka dapat buka tutup sistem dasar diskresi departemen
"Menurut saya, coba komunikasi intens ke Kaprodi bersangkutan, sebab kaprodi-lah yang paham seluk beluk mahasiswa dan mekanisme administrasi. Di UGM, sekalipun sudah single sign on (SSO), tapi departemen punya kuasa penuh untuk memberikan diskresi terhadap sistem.",2019-08-01 03:52:23,turut coba komunikasi intens kaprodi sangkut kaprodilah paham seluk beluk mahasiswa mekanisme administrasi ugm sekalipun single sign on sso departemen punya kuasa penuh beri diskresi hadap sistem
"Saya juga tahun lalu 14+2 semester. Justru pihak departemen yang membantu soal administrasi, sebab pihak mereka sadar bahwa vonis DO bisa berdampak besar pada akreditasi prodi. Untung punya kaprodi yang benar2 tanggap kendala2 administrasi mahasiswa injury time.",2019-08-01 03:50:18,juga tahun lalu semester justru pihak departemen bantu soal administrasi pihak sadar vonis do dampak besar akreditasi prodi untung punya kaprodi benar tanggap kendala administrasi mahasiswa injury time
"@Miafebsetya Wong""an kampus mu kok lucu"" mi wkwkwk",2019-08-01 03:49:55,wong kampus mu kok lucu mi wkwkwk
Untuk ngisi dan emang lumayan ribet sampai harus ke dekan ngurusinnya. Menurutku ga salah satu pihak aja sih,2019-08-01 03:47:51,ngisi emang lumayan ribet harus dekan ngurusinnya turut ga salah satu pihak aja sih
Kalo di krs lupa input gitu harusnya bagian fakultas ingetin si mahasiswa utk input karena bisa berakibat fatal. Temenku juga ada yg begini dan diingetin lgsg sama bagian adm,2019-08-01 03:46:43,kalo krs lupa input gitu fakultas ingetin si mahasiswa utk input bisa akibat fatal temenku ada yg begini diingetin lgsg sama bagi adm
Sungguh mulia adeknya mau jadi penyumbang kampus mbak betah amat kuliah 14 semester njirrr,2019-08-01 03:43:38,sungguh mulia adeknya mau jadi sumbang kampus mbak betah kuliah semester njirrr
"Entahlah beb @mrsdian_ harusnya sih klo aturan dan sistem itu baku, klo salah input di sistem mestinya bisa diperbaiki atau diganti, tp klo status nya non aktif atau tidak regis ulang entah lagi apa bisa diubah jd aktif utk bisa input nilai",2019-08-01 03:41:52,entah beb sih klo atur sistem baku klo salah input sistem mesti baik ganti tp klo status nya non aktif tidak regis ulang entah apa ubah jd aktif utk input nilai
Dududupic.twitter.com/JRTXKWqLAi,2019-08-01 03:38:59,
"Krs Online dan ada batas waktu klo ga salah 1-2 minggu, klo salah bisa diperbaiki",2019-08-01 03:36:49,krs online ada batas waktu klo ga salah minggu klo salah baik
Semoga dapat happy ending bisa wisuda..,2019-08-01 03:21:35,moga happy ending wisuda
nanti tak kasih tau rektornya,2019-08-01 03:14:33,tak kasih tau rektor
"KKN 16 Wonoayu, Kecamatan Wajak @UMMcampus pic.twitter.com/0RfAoz6ain",2019-08-01 03:10:14,kkn wonoayu camat wajak
Pak rektor @UMMcampus kok sidang nya diterima.? Kepala Humas dan Protokoler UMM Membenarkan Mahasiswa Selesai Sidang Skripsi Di Drop Out : Ini Kronologinya https://www.telaah.id/2019/08/01/kepala-humas-dan-protokoler-umm-membenarkan-mahasiswa-selesai-sidang-skripsi-di-drop-out-ini-kronologinya/ …,2019-08-01 03:07:53,pak rektor kok sidang nya terima kepala humas protokoler umm benar mahasiswa selesai sidang skripsi drop out kronologi
@citramaliarosa wah wah kampus kau nih mak,2019-08-01 03:06:31,wah wah kampus kau nih mak
@khunn4 untung koen iso diubah biyen,2019-08-01 03:04:17,untung koen iso ubah biyen
"Trima kasih banyak mas, mudah-mudahan sehat selalu",2019-08-01 03:03:50,trima kasih banyak mas mudahmudahan sehat selalu
Siip sangat membantu terima kasih banyak.,2019-08-01 02:58:46,siip sangat bantu terima kasih banyak
"Wah, kalo di umm input krs nya online atau manual ngumpulin kertas krs gt mba?",2019-08-01 02:57:06,wah kalo umm input krs nya online manual ngumpulin kertas krs gt mba
"Maaf ka, smpe gk aktif gtu status nya pernah cuti kuliah apa bgmn? Krna setau sya angkatan 2012 msa studi nya hnya smpe juli 2018 Lebih dr itu jelas DO klo tidak cuti kuliah. Klo adikny sdh ujian skripsi seharusnya itu cm mslah administrasi dn kebijakan kampus kak. Semangat",2019-08-01 02:54:50,maaf ka smpe gk aktif gtu status nya pernah cuti kuliah apa bgmn krna tau sya angkat msa studi nya hnya smpe juli lebih dr jelas do klo cuti kuliah klo adikny sdh uji skripsi itu cm mslah administrasi dn bijak kampus kak semangat
"Teman saya dari fakultas psikologi UMM, juga mengalami hal yang sama. Meskipun sudah mengusahakan, kalau statusnya nonaktif, fakultas ataupun universitas nggak bisa berbuat apa-apa, karena semua administrasi by system. Teman saya disarankan ikut wisuda periode berikutnya",2019-08-01 02:54:24,teman dari fakultas psikologi umm alami yang sama meski usaha kalau status nonaktif fakultas universitas bisa buat apaapa semua administrasi by system teman saran ikut wisuda periode ikut
"Percaya aja yang lulus lama lebih bijak besoknya di dunia yang baru, ga menganggap remeh semua pekerjaanya walaupun sekecil apapun gajinya. Mereka adalah orang orang yang lebih menghargai proses daripada hasil akhir.",2019-08-01 02:47:47,percaya aja lulus lama lebih bijak besok dunia baru ga anggap remeh semua pekerjaanya walaupun kecil apa gaji adalah orang orang lebih harga proses hasil akhir
"Lihat historinya 5 smter lainnya smuanya 0 SKS, itu permasalahan individu. Sadarlah ada ribuan anak yg DO dan org tua kecewa diluar sana jga. Sya tidak hanya lihat dari ""kacamata"" satu sisi saja dan Pihak kampus jga berhak tidak Melakukan apapun itu yg sy blg konsekuensi impact",2019-08-01 02:46:06,lihat histori smter smuanya sks masalah individu sadar ribu anak yg do org tua kecewa luar sana jga sya hanya lihat kacamata satu sisi dan pihak kampus jga hak laku apa yg sy blg konsekuensi impact
Gimana cara bayar SPP kalo belum tau jumlah SKS yang diambil? KRS bukannya untuk menentukan mata kuliah yang diambil?,2019-08-01 02:39:21,gimana cara bayar spp kalo tau jumlah sks ambil krs bukan tentu mata kuliah ambil
"Urusan teknis di lapangan dan administrasi harus jalan bareng. Secara faktual sudah boleh bikin skripsi, mengajukan judul skripsi, sampai seminar dan melaksanakan penelitian. Tapi kalo gak diproses agar terdaftar semua itu gak bakal bisa diakui.",2019-08-01 02:38:47,urus teknis lapang administrasi jalan bareng cara faktual boleh bikin skripsi aju judul skripsi seminar laksana teliti kalo gak proses daftar semua gak bakal aku
yg jadi masalah ini masnya udah semester ujung mba,2019-08-01 02:36:07,yg jadi masalah mas udah semester ujung mba
"Perihal Kasus mahasiswa #UMM yang terancam DO semoga bs diselesaikan dengan baik, dan administrasi adalah buatan manusia, input data komputer tgl diinput kalau salah tgl di delete, itu kan buatan manusia yg penting keadilan @ummcampus #kemenristekdikti",2019-08-01 02:36:02,perihal kasus mahasiswa ancam do moga bs selesai baik administrasi buat manusia input data komputer tgl diinput kalau salah tgl delete kan buat manusia yg penting adil
"Salam semangat buat adeknya mbak, insyaallah pasti ada jalan",2019-08-01 02:34:47,salam semangat buat adeknya mbak insyaallah ada jalan
Yey kampusku viral @UMMcampus,2019-08-01 02:33:46,yey kampus viral
"Stlh itu sy disuruh daftar lg sbg mhsw baru dgn status mhsw transferan. Jd dpt NIM baru tp nilai tetap sama dgn yg sdh diambil, tinggal lanjut.",2019-08-01 02:28:48,stlh sy suruh daftar lg sbg mhsw baru dgn status mhsw transfer jd dpt nim baru tp nilai tetap sama dgn yg sdh ambil tinggal lanjut
Jadi ini salah kampus atau salah anaknya ya ?,2019-08-01 02:28:28,jadi salah kampus salah anak
"https://news.detik.com/berita-jawa-timur/d-4647569/umm-sesalkan-cuitan-kakak-mahasiswa-yang-terancam-do-gara-gara-administrasi … Mahasiswa Universitas Muhammadiyah Malang (UMM) terancam drop out, meski baru selesai sidang skripsi. Semua terungkap dari cuitan Rea Handayani di twitternya.",2019-08-01 02:28:15,mahasiswa universitas muhammadiyah malang umm ancam drop out meski baru selesai sidang skripsi semua ungkap cuit rea handayani twitternya
"Pengalaman saya ya mbak, sama2 Univ Muhammadiyah dan saya jg semester banyak. Ada aturan baru kuliah 5 thn harus selesai, jk lebih DO. Skripsi jg sy hampir selesai, tp sy jg dpt surat DO.",2019-08-01 02:27:14,alam ya mbak sama univ muhammadiyah saya jg semester banyak atur baru kuliah thn selesai jk lebih do skripsi jg sy hampir selesai tp sy jg dpt surat do
"Pas ketika input, sebenarnya di sistem kan dikonfirmasi oleh fosen pembimbing, berarti kesalahan dosen pembimbingnya juga kenapa nggak ngecek pas semester mau dimulai. Di kampus kami ada kebijakan +1 semester jika untuk administrasi skripsi saja. Tapi nggak tahu kalau UMM sih.",2019-08-01 02:24:50,pas input benar sistem kan konfirmasi fosen bimbing arti salah dosen bimbing kenapa ngecek pas semester mau mulai kampus ada bijak semester untuk administrasi skripsi tapi tahu kalau umm sih
"Sebagai sesama mahasiswa Teknik Informatika yang juga sidang di semester 14. Kalau di kampus kami, bapak Kajur sangat sangat mendampingi, karena yang bertanggung jawab ke rektor ya nih kajur. Jadi pas waktu itu dorongan dari pak Kajur sangat kuat, sangat dibantu",2019-08-01 02:23:27,bagai sama mahasiswa teknik informatika juga sidang semester kalau kampus bapak kajur sangat sangat damping yang tanggung jawab rektor nih kajur jadi pas waktu dorong pak kajur sangat kuat sangat bantu
"Iyoo yaa, waduh.",2019-08-01 02:20:51,iyoo yaa waduh
ga ada KRS masuk mngkin dianggap non aktif. yakali mahasiswa kuliah tnpa mata kuliah.,2019-08-01 02:03:09,ga krs masuk mngkin anggap non aktif yakali mahasiswa kuliah tnpa mata kuliah
Tanggapan Pihak Kampus https://news.detik.com/berita-jawa-timur/d-4647491/ini-tanggapan-umm-soal-mahasiswa-terancam-do-gara-gara-administrasi … Kisah mahasiswa UMM terancam DO gara-gara administrasi viral di medsos. Pihak kampus pun angkat bicara dan menganggap itu semata-mata keteledoran mahasiswa.,2019-08-01 01:59:49,tanggap pihak kampus kisah mahasiswa umm ancam do garagara administrasi viral medsos pihak kampus angkat bicara anggap sematamata teledor mahasiswa
Sedih bacanya.... semoga pihak kampus punya rasa kemanusiaan membantu adik mbak...krn kampus yg punya kebijakan. Semoga pihak kampus membantu.,2019-08-01 01:58:24,sedih baca moga pihak kampus punya rasa manusia bantu adik mbakkrn kampus yg punya bijak moga pihak kampus bantu
"Mungkin arek 2012 gaes, di permudah sampe luput durung krs an. Lek gak salah ndek jurusanku arek 1 bimbingan ambek aku onok sing kejadian ngono pisan. Tapi dibantuin ambek dosen wali dan dosen pembimbing. Akhir e iso sidang dan lulus",2019-08-01 01:52:03,mungkin arek gaes mudah sampe luput durung krs an lek gak salah ndek jurus arek bimbing ambek aku onok sing jadi ngono pis dibantuin ambek dosen wali dosen bimbing akhir e iso sidang lulus
Tp uang nya di terima....,2019-08-01 01:50:07,tp uang nya terima
Sedang diurus.,2019-08-01 01:49:20,sedang urus
"Setauku mba, urusan KRS itu kayanya internal. Data itu bisa diubah di internal kampus (data dan informasi) lewat fakultas masing2. Saya dulu pernah ngurus masalah mirip kaya gini dan cukup ke dekan, kaprodi, dan kabag akademik (fakultas). Semoga cepet beres masalahnya",2019-08-01 01:47:43,tau mba urus krs kaya internal data bisa ubah internal kampus data informasi lewat fakultas masing dulu pernah ngurus masalah mirip kaya gin cukup dekan kaprodi kabag akademik fakultas moga cepet beres masalah
Sepertinya kesalahan sistem informasi akademik Dan TU Fakultasnya masa udah ada tagihan VA tapi KRS skripsi belum di input,2019-08-01 01:44:24,salah sistem informasi akademik tu fakultas masa udah tagih va krs skripsi di input
"Tapi kok lucu ya bisa punya berita acara sidang skripsi, dapet pembimbing tapi gak aktif statusnya ? Biasanya mulai dr pembimbing (kalau gw) bakal nge check dulu nih status mahasiswanya.... Mestinya kalau ga bisa lsg naik ke rektorat, harus lewat dekanat. Semoga cepet selesai",2019-08-01 01:40:18,kok lucu punya berita acara sidang skripsi dapet bimbing gak aktif status biasa mulai dr bimbing kalau gw bakal nge check dulu nih status mahasiswa mesti kalau ga bisa lsg naik rektorat lewat dekanat moga cepet selesai
"Sudah. Sudah ketemu rektor. Rektor udah ok, tapi kepala BAAK yang tetap kekeuh men-DO",2019-08-01 01:33:51,sudah ketemu rektor rektor udah tapi kepala baak tetap kekeuh mendo
Andai gak ada skripsi,2019-08-01 01:33:22,andai gak skripsi
"Merasa ada cerita yang hilang disini, kalo dati sisi pandang saya sih memang kesalahan dari adik mbaknya. Sistem susah untuk dirubah, dan biasanya orang kampus itu menyewa pihak ketiga lain untuk membuat sistemnya, yang ditauin sama kampus cuma maintenance.",2019-08-01 01:33:05,rasa cerita hilang sini kalo dati sisi pandang sih memang salah adik mbak sistem susah rubah biasa orang kampus sewa pihak tiga untuk buat sistem ditauin sama kampus cuma maintenance
"semua tahap dari dosen wali, jurusan, dekan, warek, hingga rektor sudah dilakukan semua. Kakaknya juga udah mengajukan pengaduan juga ke kemristekdikti. Jadi ga ujug-ujug ngadu di twitter.",2019-08-01 01:32:52,semua tahap dosen wali jurus dekan warek hingga rektor laku semua kakak udah aju adu ke kemristekdikti jadi ga ujugujug ngadu twitter
sudah dilakukan semua.,2019-08-01 01:31:31,laku semua
"kan sudah menemui rektor, semua jenjang sudah dilewati. Dari Dikri juga sudah welcome. Yang kekeuh itu kampusnya.",2019-08-01 01:29:52,kan temu rektor semua jenjang lewat dikri sudah welcome kekeuh kampus
"Saya keingat cengkok samean bang pas di bagian, ""..... kuw nuuu ann shoorollaahi kamaa qaala 'isabnu maryam ....""pic.twitter.com/pNiXy0VPal",2019-08-01 01:28:25,ingat cengkok samean bang pas bagi kuw nuuu ann shoorollaahi kamaa qaala isabnu maryam
Mahasiswa berhak kuliah 14 semester. Dia juga bayar. Jadi tidak bisa hal itu dijadikan kesalahan. Orang kuliah 14 semester itu tidak selalu karena kemalasan. Kebutuhan hidup orang beda-beda. Ada yang kuliah nyambil menghidupi keluarga.,2019-08-01 01:28:05,mahasiswa hak kuliah semester juga bayar jadi bisa jadi salah orang kuliah semester itu tidak selalu malas butuh hidup orang bedabeda yang kuliah nyambil hidup keluarga
"Kalo prosedur kampus sbnrnya gaboleh sidang pas ketauan blum krs an, tp kyknya kasus mas nya ini sama kyk aku, bisa lolos sampe sidang, cuman ijazahnya ini yg gabisa dikeluarin krn krs nya kan nyambung ke dikti itu tadi.",2019-08-01 01:24:54,kalo prosedur kampus sbnrnya gaboleh sidang pas tau blum krs an tp kyknya kasus mas nya sama kyk aku lolos sampe sidang cuman ijazah yg gabisa dikeluarin krn krs nya kan nyambung dikti tadi
Setau saya mbak akhir semester itu bulan agustus tahun semester baru bulan september. Jadi masih punya waktu 1 bulan lagi untuk semester 14 menyelesaikan semuanya tapi gatau ya di umm.,2019-08-01 01:23:36,tau mbak akhir semester bulan agustus tahun semester baru bulan september jadi punya waktu bulan untuk semester selesai semua gatau di umm
"Kalo kmren aku jg gitu, cuman ketauan nya emg pas mau sidang, ternyata sempro/sidang itu kebijakannya dr jurusan (kalo di fisip) jd bisa sidang meskipun blum krs an soalny uda bayar dll. Cuman ya itu, pas uda waktunya krs an harus klik, daftarin berkas lagi, baru bisa wisuda",2019-08-01 01:23:05,kalo kmren aku jg gitu cuman tau nya emg pas mau sidang nyata semprosidang bijak dr jurus kalo fisip jd sidang meski blum krs an soalny uda bayar cuman itu pas uda waktu krs an klik daftarin berkas baru wisuda
Kenapa ya univ muhamadiya dimana pun selalu bermasalah administrasi di akhir?,2019-08-01 01:21:11,ya univ muhamadiya mana selalu masalah administrasi akhir
Andai mahasiswanya cermat seperti yang diajarkan di pkkmb FE,2019-08-01 01:19:36,andai mahasiswa cermat yang ajar pkkmb fe
Bertanya tanya ni orang udah sidang. Kok nggak wisuda wisuda. Lupa krs skripsi itu kesalahan yang cukup fatal emang.,2019-08-01 01:17:01,tanya tanya ni orang udah sidang kok wisuda wisuda lupa krs skripsi salah cukup fatal emang
Tapi rela lulus bareng mereka? Kamu masuk kuliah lagi langsunh dibawa pulang aja. Bungkussss!,2019-08-01 01:16:58,rela lulus bareng kamu masuk kuliah langsunh bawa pulang aja bungkussss
"Jadi inget momen hbs sidang langsung ada masalah gini, dulu sampe nangis2 di fakultas sampe bisa ikhlas akhirnya semua ternyata ada hikmahnya huhu",2019-08-01 01:13:05,jadi inget momen hbs sidang langsung masalah gin dulu sampe nang fakultas sampe ikhlas akhir semua nyata hikmah huhu
Kak begimana ni @TentangDewi selama kita di mawa pun jg gitu yak prosedurnya. Langkah2 yg sdh dilakukan sudah bener sih langsung ke kemenristek. Soalny kmren kasusku juga hampir sama akhirnya balik krs an lagi dan ketunda lama wisudanya. Tp masalahnya ini angkatan 2012 yah,2019-08-01 01:11:28,kak begimana ni lama di mawa jg gitu yak prosedur langkah yg sdh laku bener sih langsung kemenristek soalny kmren kasus hampir sama akhir balik krs an dan tunda lama wisuda tp masalah angkat yah
"Ngadep ke dekan bidang akademik, ngomong baik2. Pasti dibantu, jgn ngomong di medsos entar malah runyam... Berharap kok ke dunia maya.. -_- Tp semoga cepet selesailah dan bisa wisuda",2019-08-01 01:10:39,ngadep dekan bidang akademik ngomong baik bantu jgn ngomong medsos entar malah runyam harap kok dunia maya tp moga cepet selesai bisa wisuda
Aku bacanya bener2 nahan nangis kak Ga kebayang kalau ngalamin sendiri Semoga bisa diurus dan pihak kampus mau bantu. Semoga diberikan jalan dan kemudahan oleh-Nya. Semangat kak!,2019-08-01 01:06:49,aku baca bener nahan nang kak ga bayang kalau ngalamin sendiri moga urus pihak kampus mau bantu moga beri jalan mudah semangat kak
"saya slh satu operator di salah satu PT, dan sepengetahuan saya adik mbak masih bisa diselamatkan kok, selagi belum masuk ke Tahun Ajaran Baru 2019/2020, KRS Skripsi itu harusnya masih bisa diinputkan ke sistem dan dilaporkan ke FORLAP. Semoga ada jalan keluar dr pihak kampus.",2019-08-01 01:02:41,slh satu operator salah satu pt tahu adik mbak bisa selamat kok belum masuk tahun ajar baru krs skripsi harus bisa diinputkan sistem lapor forlap moga jalan keluar dr pihak kampus
"Kak coba ke kajur dulu, ntar kl gbs coba ke baa, semoga bs wisuda segera ya adiknya",2019-08-01 00:56:36,kak coba kajur dulu ntar kl gbs coba baa moga bs wisuda segera adik
"Mestinya bisa mba, memang biasanya urusannya langsung ke pak Rektor. Ikut prihatin dengan cobaan ini. Kasihan orang tua dan keluarga, adiknya terutama. Sistem pendidikan kita sangat mendewakan administrasi, kadang melupakan esensi manusia dan pendidikan itu sendiri. Menyedihkan.",2019-08-01 00:54:00,mesti mba memang biasa urus langsung pak rektor ikut prihatin coba kasihan orang tua keluarga adik utama sistem didik sangat dewa administrasi kadang lupa esensi manusia didik sendiri sedih
"Wah mbak ini sering banget ditemuin di banyak kampus, termasuk kampus saya. Kalau di kampus saya justru untuk mahasiswa yg gabisa tambah semester ada pengecualian dan bisa diadvokasikan ke dirpen, ditmawa dan rektornya",2019-08-01 00:50:28,wah mbak sering banget ditemuin banyak kampus masuk kampus kalau kampus justru mahasiswa yg gabisa tambah semester kecuali bisa advokasi dirpen ditmawa rektor
"Mas Rahil anak IT kan? Semoga Mas Rahil jadi orang sukses yang kemudian bisa benahin sistem di kampus yang sempat mengecewakan Mas Rahil dan juga keluarganya ya, Mas Yan! Semangat Mas Rahil",2019-08-01 00:39:19,mas rahil anak it kan moga mas rahil jadi orang sukses kemudian benahin sistem kampus sempat kecewa mas rahil juga keluarga mas yan semangat mas rahil
"Mba maaf mau tanya, utk dapat SK pembimbing itu bagaimana? Atau hanya mengumpulkan kwitansi ke jurusan aja? Mohon maaf sekaligus buat pelajaran saya, krn saya juga mhs di kampus dan jurusan seperti adeknya mba :)",2019-08-01 00:37:01,mba maaf mau tanya utk sk bimbing bagaimana hanya kumpul kwitansi jurus aja mohon maaf sekaligus buat ajar krn juga mhs kampus jurus adeknya mba
Aku mendukung demo ke BAA,2019-08-01 00:34:20,aku dukung demo baa
"Ojok emosi mas, iki kampus soale guduk akun medsose Lupabapak sing cs admin e ancene ngerti banget lek onok keluhan cepet ditangani. Emosipun gak marai masalah cepet selesai.",2019-08-01 00:32:54,ojok emosi mas iki kampus soale guduk akun medsose lupabapak sing cs admin e ancene ngerti banget lek onok keluh cepet tangan emosi gak mara masalah cepet selesai
"Mohon jangan ada yg menyalahkan,, semoga kasus ini tidak terulang dan jadi pelajaran untuk saya dan semua, dan semoga bisa diselesaikan dengan penyelesaian terbaik untuk semua pihak. Mohon maaf.",2019-08-01 00:32:14,mohon jangan yg salah moga kasus tidak ulang jadi ajar saya semua moga selesai selesai baik semua pihak mohon maaf
Apakah sebagai kakak sudah memikirkan bagai mana perasaan adik jika ini terlanjur viral dan semua yg mengenalnya tau akan hal ini https://twitter.com/malarea/status/1156468738306088961?s=19 …,2019-08-01 00:30:38,bagai kakak pikir bagai mana asa adik lanjur viral semua yg kenal tau hal ini
