text,date,cleaned_tweets
"@ummcampus ngadain Kompetisi Karya Kreatif, alias lomba PKM buat kamu mahasiswa aktif UMM. Langsung aja kirim karya terbaik kamu sebelum tanggal 30 Desember 2019 ya #PotretUMM",2019-12-18 08:42:09,ngadain kompetisi karya kreatif alias lomba pkm buat kamu mahasiswa aktif umm langsung aja kirim karya baik kamu tanggal desember
Banyak banget agenda dari @ummcampus yang diselenggarain buat menyambut Milad UMM ke 55. Stay tune buat tau kelanjutan infonya ya #PotretUMM,2019-12-18 08:28:37,banyak banget agenda yang diselenggarain buat sambut milad umm stay tune buat tau lanjut info
"Jadi anak bola dulu aja, gitu tahapannya dik wkkkk",2019-12-16 21:53:03,jadi anak bola dulu aja gitu tahap dik wkkkk
"Berbicara HAM berarti kebebasan berekspresi kok malah diatur, situ ngawur! @UMMcampus",2019-12-16 16:46:40,bicara ham arti bebas ekspres kok malah atur situ ngawur
"Aku mau main, tapi ga boleh loh....wkwkwkwkwk",2019-12-16 13:27:12,aku mau main ga lohwkwkwkwkwk
Selamat kepada tim sepak bola @UMMcampus yang menjuarai Liga HW 2019 zona Jatim setelah mengalahkan PS HW Sidoarjo 2-0. . UMM akan mewakili Jatim ke putaran nasional @LigaHw . #MuhammadiyahTakBisaDibelipic.twitter.com/g6xkNwcavF,2019-12-16 10:23:21,selamat tim sepak bola juara liga hw zona jatim kalah ps hw sidoarjo umm wakil jatim putar nasional
"Wadiaaah seng tak lewat BCA Klojen wes gak muter muteran maneh nak Tlogomas. Thanks a looott. Kan tupperware e kakak wes wakeh gausa berharap aku yg dapat kau yg memiliki ya, Ijah.",2019-12-16 03:02:35,wadiaaah seng tak lewat bca klojen wes gak muter muteran maneh nak tlogomas thanks a looott kan tupperware e kakak wes wakeh gausa harap aku yg kau yg milik ijah
"Wah ngeneki nek gak koordinasi sek. Haruse km buka Xpresi di BCA @UMMcampus , ada free tupperware, totebag macem2, mbak e yo buwwaaaeekkk pwol manis ayu koyok aku maksimal",2019-12-16 02:53:51,wah ngeneki nek gak koordinasi sek haruse km buka xpresi bca free tupperware totebag macem mbak e yo buwwaaaeekkk pwol manis ayu koyok aku maksimal
Kangen sopo manehh hmm,2019-12-15 09:32:57,kangen sopo manehh hmm
Kalo kangen ngomong ler... Nggak usah ngode...,2019-12-15 09:32:10,kalo kangen ngomong ler usah ngode
Wooo ... jurusan dan kampus yang gak jadi apply gegara sudah full di gel. 1 dan akhirnya move ke @UMMcampus . *mbois penerus silaban kayaknya https://twitter.com/jawapos/status/1205846584300228608 …,2019-12-14 13:52:18,wooo jurus kampus gak jadi apply gegara full gel akhir move mbois terus silaban kayak
"Sedang berlangsung Konferensi Nasional Ke-9 Asosiasi Program Pascasarjana Perguruan Tinggi Muhammadiyah-Aisyiyah (APPPTMA) di @UMMcampus mengusung tema ""Orientasi Program Pascasarjana PTMA dalam Memperkuat Tradisi Riset dan Publikasi"" pic.twitter.com/XXWElf0NoT",2019-12-14 01:52:05,sedang langsung konferensi nasional asosiasi program pascasarjana guru tinggi muhammadiyahaisyiyah appptma usung tema orientasi program pascasarjana ptma kuat tradisi riset publikasi
it bknny d masjid umm ya? mgkn bs dbantu k @UMMcampus @UMMstory64 untuk share lebih luas,2019-12-13 16:25:42,it bknny d masjid umm mgkn bs dbantu k share lebih luas
"Mari ikuti acara ini, dijamin bermanfaat dunia dan akhirat. @infomalang @PemkotMalang @mahasiswamlg @UMMcampus @radar_malang @eventmalang @MalangTimes @RRIMalangpic.twitter.com/BQe30JojTc",2019-12-13 00:14:23,ikut acara jamin manfaat dunia akhirat
"Waduh, sek tok aku beredar ke Eropa mariki wkwkwk",2019-12-12 12:39:42,waduh sek tok aku edar eropa mariki wkwkwk
"Ada yang Tahu ini logo Tim Mana saja? Ini adalah sebagian Logo Tim yang akan bermain di Liga HW 2019 Zona 3, Jawa Timur. Setelah Zona 2 selesai digelar dikampus http://ump.ac.id kini Zona 3 akan digelar dikampus @ummcampus https://www.instagram.com/p/B52bHJYgP7e/?igshid=89a1ttrb09gm …",2019-12-12 12:03:44,tahu logo tim mana ini bagi logo tim yang main liga hw zona jawa timur zona selesai gelar kampus kini zona akan gelar kampus
Jangan lupa keseruan Tim bermain di Liga Hw 2019 Zona 3 di @ummcampus Malang #muhammadiyah #semarakmuktamar48 #umm https://www.instagram.com/p/B54LUzHgpL3/?igshid=o9q43jkawtlt …,2019-12-12 12:03:37,jangan lupa seru tim main liga hw zona malang
Keseruan pertandingan dihari pertama liga HW 2019 Zona 3 di @ummcampus antara pwpmjatim vs umjemberfc @muhammadiyah @tvmuhammadiyah @pp_pm2018 #muhammadiyah #semarakmuktamar48 #umm https://www.instagram.com/p/B5-L0XEAIm_/?igshid=r78njv7pzj9 …,2019-12-12 12:03:20,seru tanding hari pertama liga hw zona antara pwpmjatim vs umjemberfc
"Medali perak diraih di ajang internasional berkat inovasi mahasiswa UMM yang bantu percepatan produksi garam. Prestasi tersebut disabet di ajang inovasi tingkat dunia AI-JAM di Tokyo, Jepang, pada 8 Desember lalu. Baca berita selengkapnya di http://www.umm.ac.id/id/berita/smart-tongkang-karya-mahasiswa-umm-raih-silver-medal-di-jepang.html … #UMMCampuspic.twitter.com/GvZy1xnAPO",2019-12-12 10:11:10,medali perak raih ajang internasional berkat inovasi mahasiswa umm bantu cepat produksi garam prestasi sebut sabet ajang inovasi tingkat dunia aijam tokyo jepang desember lalu baca berita lengkap
"Nah itu dia hehehe, pinter banget kan yang bikin konsep",2019-12-12 07:54:45,nah dia hehehe pinter banget kan bikin konsep
Mulai cocok logi demi mencari sensasi dan provokasi,2019-12-12 02:02:37,mulai cocok log cari sensasi provokasi
Yang lebih mengherankan ada ya yang coba memprovokasi umat islam,2019-12-12 01:56:43,lebih heran ya coba provokasi umat islam
"Yg mengherankan, ada muslimah yg enggan menjalankan syariah Islam sesuai perintah Allah di dalam Alquran, diberi gelar TOKOH PEMAJUAN EKONOMI SYARIAH. #rezimkrisismoral cc @UMMcampus pic.twitter.com/wJqgMgXUN8",2019-12-11 11:02:39,yg heran muslimah yg enggan jalan syariah islam sesuai perintah allah dalam alquran beri gelar tokoh maju ekonomi syariah cc
Memanggil @ecanapril,2019-12-11 10:04:44,panggil
"Arek-arek Sidoarjo! #UMMCampus hadir di kotamu! Calon mahasiswa baru UMM arek Sidoarjo & sekitarnya, bisa datang langsung ke pameran ini pada: . Kamis, 12 Desember 2019 08.00-18.00 GOR Tennis Indoor Sidoarjo Ikuti ujiannya dan dapatkan hasilnya saat itu juga! #PMBUMM2020pic.twitter.com/MjsK0C9okR",2019-12-11 10:02:56,arekarek sidoarjo hadir kota calon mahasiswa baru umm arek sidoarjo bisa datang langsung pamer pada kamis desember gor tennis indoor sidoarjo ikut uji dapat hasil itu
"Kalo ini aku setuju, asli gak masalah. Meskipun datang kampus mepet2 musti lari / jalan cepat ke kelas dari parkiran depan ke GKB 3. Itu seru ... Seni nya @UMMcampus ya itu, munggah mudun e. https://twitter.com/ummstory64/status/1204632482789777408 …",2019-12-11 06:26:49,kalo aku tuju asli gak masalah meski datang kampus mepet musti lari jalan cepat kelas parkir depan gkb seru seni nya itu munggah mudun e
FT UMM Teken Kerjasama dengan UTM | http://www.umm.ac.id/id/berita/ft-umm-teken-kerjasama-dengan-utm.html … | #UMMCampuspic.twitter.com/y5w6EEces3,2019-12-11 06:00:00,ft umm teken kerjasama utm
Sekda Malang di UMM: Kita Harus Mampu Memberikan Inovasi | http://www.umm.ac.id/id/berita/sekda-malang-di-umm-kita-harus-mampu-memberikan-inovasi.html … | #UMMCampuspic.twitter.com/8Au5mgU5bx,2019-12-11 05:30:00,sekda malang umm harus mampu beri inovasi
Smart Tongkang Karya Mahasiswa UMM Raih Silver Medal di Jepang | http://www.umm.ac.id/id/berita/smart-tongkang-karya-mahasiswa-umm-raih-silver-medal-di-jepang.html … | #UMMCampuspic.twitter.com/5zepBlFxGf,2019-12-11 05:00:00,smart tongkang karya mahasiswa umm raih silver medal jepang
"Angkat Isu Pendidikan Inklusif, Psikologi UMM Undang Pembicara dari India | http://www.umm.ac.id/id/berita/angkat-isu-pendidikan-inklusif-psikologi-umm-undang-pembicara-dari-india.html … | #UMMCampuspic.twitter.com/5qTWpIcgFh",2019-12-11 04:34:00,angkat isu didik inklusif psikologi umm undang bicara india
"@habibb_un febuari bol, gelem po",2019-12-11 04:17:19,febuari bol gelem po
Perpustakaan UMM Pertahankan Akreditasi A | http://www.umm.ac.id/id/berita/perpustakaan-umm-pertahankan-akreditasi-a.html … | #UMMCampuspic.twitter.com/N9FsUeXl7b,2019-12-11 04:00:00,pustaka umm tahan akreditasi a
Teknologi Smart Tongkang Karya Mahasiswa UMM Siap Unjuk Gigi di Jepang | http://www.umm.ac.id/id/berita/teknologi-smart-tongkang-karya-mahasiswa-umm-siap-unjuk-gigi-di-jepang.html … | #UMMCampuspic.twitter.com/iTj2laDx4j,2019-12-11 03:31:00,teknologi smart tongkang karya mahasiswa umm siap unjuk gigi jepang
"Ciptakan Helm Pintar, Mahasiswa UMM Sabet Bronze Medal di Korea Selatan | http://www.umm.ac.id/id/berita/ciptakan-helm-pintar-mahasiswa-umm-sabet-bronze-medal-di-korea-selatan.html … | #UMMCampuspic.twitter.com/E1tEpcxv1t",2019-12-11 03:09:17,cipta helm pintar mahasiswa umm sabet bronze medal korea selatan
Semnas FEB UMM: Bahas Masa Depan Fintech di Indonesia | http://www.umm.ac.id/id/berita/semnas-feb-umm-bahas-masa-depan-fintech-di-indonesia.html … | #UMMCampuspic.twitter.com/OMyTTVdJ2n,2019-12-11 02:40:00,semnas feb umm bahas masa depan fintech indonesia
"Ditambah lagi kedatangan mereka menjadi pemanis dihari bahagia itu Disempatkan hadir dikala kesibukan masing2. Kalian sosweet rek. Makasih @UMMcampus, dari sini saya banyak pengalaman Belajar bukan cuma menatap buku. Banyak hal banyak cara. Malang 30 November 2019. - pic.twitter.com/VWcWf4GgF8",2019-12-10 15:28:00,tambah datang jadi man hari bahagia sempat hadir kala sibuk masing kalian sosweet rek makasih sini banyak alam ajar bukan cuma tatap buku banyak banyak cara malang november
g sopan.,2019-12-10 12:41:13,g sopan
yg kalo diliat sekilas aja bikin dada ayemmmmm,2019-12-10 12:40:45,yg kalo liat kilas aja bikin dada ayemmmmm
Cantik yg kaya gmn y ? Ehk,2019-12-10 12:39:18,cantik yg kaya gmn y ehk
@antakentang coba mbak2 umm yg cantik di follow twitternya,2019-12-10 12:30:22,coba mbak umm yg cantik follow twitternya
"Tolong jng bahas skripsi ya, min, ini topik sensitif",2019-12-10 11:49:41,jng bahas skripsi min topik sensitif
Semangat,2019-12-10 10:16:26,semangat
Ada yang bisa saya bantu,2019-12-10 08:14:17,yang saya bantu
Masih hujan,2019-12-10 07:59:40,hujan
Setengah selesai,2019-12-10 07:12:25,tengah selesai
@DanaHarum @andihardianto15 Siap?,2019-12-10 07:06:18,siap
Dorong kecandak,2019-12-10 05:37:36,dorong candak
Eee mbuh,2019-12-10 04:52:02,eee mbuh
Belum di acc juga d:((,2019-12-10 01:53:48,di acc d
Ujian pkl belum!!,2019-12-09 23:16:02,uji pkl
Yang Jurusan TEKNIK SIPIL semangat Skripsinya.,2019-12-09 23:00:05,jurus teknik sipil semangat skripsi
Yok semangat yok pejuang skripsi . Sambat boleh tapi jangan sampai ambyar yaakk manteman. Ehehe,2019-12-09 21:33:38,yok semangat yok juang skripsi sambat tapi jangan ambyar yaakk manteman ehehe
Bertahun tahun,2019-12-09 19:13:22,tahun tahun
smt. 5 aja udah mumet nih kepala,2019-12-09 18:55:12,smt aja udah mumet nih kepala
makin naik semester makin banyak beban pikiran engga tugas engga skripsi engga praktikum,2019-12-09 18:23:59,makin naik semester makin banyak beban pikir engga tugas engga skripsi engga praktikum
Pengen loncat dari lantai paling atas gkb 2 tapi nanti takut viral :'),2019-12-09 18:13:53,ken loncat lantai paling atas gkb nanti takut viral
"Lqgi otw, doakan akhir Desember bisa kelar,, januari sidang februari wisuda",2019-12-09 18:05:16,lqgi otw doa akhir desember kelar januari sidang februari wisuda
udah pernah tahun lalu,2019-12-09 17:43:50,udah pernah tahun lalu
"Pak btw bukan beberapa hari lagi pak :"") beberapa minggu lg Tp belom selesai, apa gada kiat mau bantuin saya gt? Wk",2019-12-09 17:30:37,pak btw bukan beberapa hari pak beberapa minggu lg tp bom selesai apa gada kiat mau bantuin gt wk
Tugas akhir gak kelar kelar,2019-12-09 17:29:33,tugas akhir gak kelar kelar
min bantuin bisa kali biar kelar,2019-12-09 17:28:03,min bantuin kali biar kelar
Berapa hari lagi menuju 2020... Sudahkah skripsi selesai? #UMMCampus,2019-12-09 17:26:51,berapa hari tuju skripsi selesai
"Malah tag akun aslinya, terbaik emang nim 011",2019-12-09 04:10:07,malah tag akun asli baik emang nim
"Gayaaaa yaa yg storynya di nusa penida, @ummcampus kalau almet dijadiin keset sangsinya apa ya?",2019-12-09 04:08:23,gayaaaa yaa yg storynya nusa penida kalau almet dijadiin keset sangsi apa
Perpustakaan UMM Pertahankan Akreditasi A http://bit.ly/2sclZve @UMMcampus,2019-12-09 03:54:06,pustaka umm tahan akreditasi a
Kelanjutan kasus gmn?,2019-12-09 00:51:50,lanjut kasus gmn
"Maaf, yang bener husnul bukan khusnul",2019-12-07 22:42:19,maaf bener husnul bukan khusnul
Innalillahi wainailaihi raji'un...smoga khusnul khotimah,2019-12-07 22:36:10,innalillahi wainailaihi rajiunsmoga khusnul khotimah
"Yang nabrak siapa? Apapun jabatannya, profesinya. Mestinya pelaku bertanggung jawab. Nggak lari. Allahuma igfir Yafi Putra Setyadi warhamhu wa afiehi wa'fu anhu.",2019-12-07 16:22:24,nabrak siapa apa jabat profesi mesti laku tanggung jawab lari allahuma igfir yafi putra setyadi warhamhu wa afiehi wafu anhu
Kecelakaan tabrak lari..,2019-12-07 15:27:59,celaka tabrak lari
ini yang tadi kecelakaan,2019-12-07 14:09:22,yang tadi celaka
"Innalillahiwa'inailaihiroji'un... Btw, meninggalnya karena apa min? kok sampe di announced sama akun kampus?",2019-12-07 13:27:45,innalillahiwainailaihirojiun btw tinggal apa min kok sampe announced sama akun kampus
"#BERITADUKAUMM Innalillahi wainna ilaihi rojiun Segenap civitas akademika UMM turut berbela sungkawa atas berpulangnya: Yafri Putra Sityadi, mahasiswa Prodi Ilmu Keperawatan Semoga Allah mengampuni dosa almarhum & menerima segala amal ibadahnya semasa hidup. Amin. #ummcampuspic.twitter.com/NtY5CypoGU",2019-12-07 13:22:14,innalillahi wainna ilaihi rojiun segenap civitas akademika umm turut bela sungkawa atas pulang yafri putra sityadi mahasiswa prodi ilmu awat moga allah ampun dosa almarhum terima segala amal ibadah masa hidup amin
"Helm Pintar Pancarkan Koordinat GPS, Berguna dalam Kedaruratan | Surabaya - http://Bisnis.com http://bitly.com/2DPLWmW @UMMcampus",2019-12-06 10:27:02,helm pintar pancar koordinat gps dalam darurat surabaya
Mantull,2019-12-04 22:27:28,mantull
Refleksi akhir tahun 2019 Ikatan Sosiologi Indonesia Malang Raya. Nawakalam Gemulo. Sosiologi FISIP UMM. @ummcampus thenewschoollllll @thenewschool sounding from Sosiolog Dr.Rachmad Dwi Susilo. @Universitas… https://www.instagram.com/p/B5qMEqHAEgX/?igshid=4b3mdrksktj1 …,2019-12-04 17:39:21,refleksi akhir tahun ikat sosiologi indonesia malang raya nawakalam gemulo sosiologi fisip umm thenewschoollllll sounding from sosiolog drrachmad dwi susilo
Keren,2019-12-04 12:25:03,keren
Pakai aplikasi apa mbak?,2019-12-04 07:35:04,pakai aplikasi apa mbak
"Pengakuan Rocky, saya tdk pancasilais. !!!! Himbauan aja buat Universitas2 perguruan tinggi Negeri dan Swasta @univ_indonesia @UMMcampus dllnya, pantaskah di jadikan pengajar di kampus, org yg mengaku tdk pancasila ? @InfoMendiknas",2019-12-04 02:52:24,aku rocky tdk pancasilais himbauan aja buat universitas guru tinggi negeri swasta dllnya pantas jadi ajar kampus org yg aku tdk pancasila
Dosen UMM Terpilih Jadi Ketua 2 Organisasi Kesehatan | http://www.umm.ac.id/id/berita/dosen-umm-terpilih-jadi-ketua-2-organisasi-kesehatan.html … | #UMMCampuspic.twitter.com/gL5C5wvqLk,2019-12-04 02:00:00,dosen umm pilih jadi ketua organisasi sehat
"Sudah kami sesuaikan, bisa disimak di Youtube SM TV Channel. Kedepan juga akan kami perbaiki, terima kasih",2019-12-04 01:55:12,sesuai simak youtube sm tv channel depan akan kami baik terima kasih
Napak Tilas Sejarah UMM Sambil Mancing dan Uklam Santuy | http://www.umm.ac.id/id/berita/napak-tilas-sejarah-umm-sambil-mancing-dan-uklam-santuy.html … | #UMMCampuspic.twitter.com/nMEisK7to1,2019-12-04 01:30:00,napak tilas sejarah umm mancing uklam santuy
Menko PMK Orasi di Wisuda UMM: Pendidikan Tinggi Penentu Kualitas Manusia Indonesia | http://www.umm.ac.id/id/berita/menko-pmk-orasi-di-wisuda-umm-pendidikan-tinggi-penentu-kualitas-manusia-indonesia.html … | #UMMCampuspic.twitter.com/erjRovLF3l,2019-12-04 01:00:00,menko pmk orasi wisuda umm didik tinggi kualitas manusia indonesia
"Asik banget saya bisa join diskusi online-nya, bisa menyimak secara online dari rumah. SM sering2 adakan diskusi online lagi yaa Keren acaranya, sukses selalu untuk tim SM pic.twitter.com/TKmqU5024F",2019-12-03 13:58:45,asik banget join diskusi onlinenya bisa simak cara online rumah sm sering adakan diskusi online yaa keren acara sukses selalu tim sm
"Saya buka youtube, suaranya nggak jelas. Bising dan bikin sakit telinga.",2019-12-03 13:32:27,buka youtube suara jelas bising bikin sakit telinga
Sophia Mega Ajak Generasi Milenial Kenali Potensi Diri | http://www.umm.ac.id/id/berita/sophia-mega-ajak-generasi-milenial-kenali-potensi-diri.html … | #UMMCampuspic.twitter.com/thAYZWsdgz,2019-12-03 13:00:00,sophia mega ajak generasi milenial kenal potensi diri
"Cinta Al Quran, Hafidzah Ini Sabet Gelar Wisudawan Terbaik | http://www.umm.ac.id/id/berita/cinta-al-quran-hafidzah-ini-sabet-gelar-wisudawan-terbaik.html … | #UMMCampuspic.twitter.com/W8hoDVaouR",2019-12-03 12:30:00,cinta al quran hafidzah sabet gelar wisudawan baik
"Sabet 2 Gelar, Mahasiswa UMM Dominasi Kemenangan di Ajang Debat Nasional | http://www.umm.ac.id/id/berita/sabet-2-gelar-mahasiswa-umm-dominasi-kemenangan-di-ajang-debat-nasional.html … | #UMMCampuspic.twitter.com/jWkejPjbuZ",2019-12-03 12:00:00,sabet gelar mahasiswa umm dominasi menang ajang debat nasional
"Sisihkan UGM, Kopma UMM Sabet Piala Tetap Gubernur Banten | http://www.umm.ac.id/id/berita/sisihkan-ugm-kopma-umm-sabet-piala-tetap-gubernur-banten.html … | #UMMCampuspic.twitter.com/pUdUVYDpYN",2019-12-03 11:30:00,sisih ugm kopma umm sabet piala tetap gubernur banten
Seminar Nasional FH UMM: Bahas Advokat dan Contempt of Court dalam RUU KUHP | http://www.umm.ac.id/id/berita/seminar-nasional-fh-umm-bahas-advokat-dan-contempt-of-court-dalam-ruu-kuhp.html … | #UMmCampuspic.twitter.com/JvB5HM48Oj,2019-12-03 11:00:00,seminar nasional fh umm bahas advokat contempt of court ruu kuhp
"Komparasi Isu Sosial, Kesos UMM Berangkatkan Mahasiswa Visiting Study ke Malaysia | http://www.umm.ac.id/id/berita/komparasi-isu-sosial-kesos-umm-berangkatkan-mahasiswa-visiting-study-ke-malaysia.html … | #UMMCampuspic.twitter.com/F29pstHkq3",2019-12-03 10:30:00,komparasi isu sosial kesos umm berangkat mahasiswa visiting study malaysia
"Terima kasih telah mengunjungi kami dan mention kami @ptinka. Manufaktur perkeretaapian yang pertama, terbesar, dan terintegrasi penuh di Asia Tenggara. Jangan lupa untuk memfollow kami juga ya...",2019-12-03 10:07:12,terima kasih unjung mention manufaktur perkeretaapian pertama besar dan integrasi penuh asia tenggara jangan lupa memfollow juga
PT INKA Buka Kerjasama dengan Prodi HI UMM | http://www.umm.ac.id/id/berita/pt-inka-buka-kerjasama-dengan-prodi-hi-umm.html … | #UMMCampuspic.twitter.com/YYRzHQE3kq,2019-12-03 10:00:00,pt inka buka kerjasama prodi hi umm
"Rancang Kurikulum Baru, AIK UMM akan Jadi Jembatan Ilmu Agama Islam dan Ilmu Pengetahuan Umum | http://www.umm.ac.id/id/berita/rancang-kurikulum-baru-aik-umm-akan-jadi-jembatan-ilmu-agama-islam-dan-ilmu-pengetahuan-umum.html … | #UMMCampuspic.twitter.com/4NgWE4XCGT",2019-12-03 09:30:00,rancang kurikulum baru aik umm jadi jembatan ilmu agama islam ilmu tahu umum
"Sisihkan Ratusan Pesaing, Mahasiswa UMM Raih Gold Medal di Singapura | http://www.umm.ac.id/id/berita/.html | #UMMCampuspic.twitter.com/OMdXgTEOhC",2019-12-03 09:00:00,sisih ratus saing mahasiswa umm raih gold medal singapura
insyaAllah aku siap jadi imamnya mbaknya,2019-12-03 08:53:01,insyaallah aku siap jadi imam mbak
"Fakultas Psikologi UMM, Berikan Materi Psikodukasi Bagi Mahasiswa Baru | http://www.umm.ac.id/id/berita/fakultas-psikologi-umm-berikan-materi-psikodukasi-bagi-mahasiswa-baru.html … | #UMMCampuspic.twitter.com/clM7k7jbzp",2019-12-03 08:30:00,fakultas psikologi umm ikan materi psikodukasi mahasiswa baru
Puluhan Mahasiswa Asing Belajar Teknik Membatik ala Jepang di UMM | http://www.umm.ac.id/id/berita/puluhan-mahasiswa-asing-belajar-teknik-membatik-ala-jepang-di-umm.html … | #UMMCampuspic.twitter.com/zamxIeugvn,2019-12-03 08:00:00,puluh mahasiswa asing ajar teknik batik ala jepang umm
Cerita Lulusan UMM yang Jadi Dokter di Usia 20 Tahun | http://www.umm.ac.id/id/berita/cerita-lulusan-umm-yang-jadi-dokter-di-usia-20-tahun.html … | #UMMCampuspic.twitter.com/8Zur0TD0ua,2019-12-03 07:30:00,cerita lulus umm jadi dokter usia tahun
Bagi audiens/penanya terpilih Diskusi Online Interaktif berkesempatan mendapatkan 1 Bulan Berlangganan Majalah SM Digital untuk 2 orang pemenang Sampaikan juga komentar anda tentang tema di Twitter dengan tagar #HijrahTerus mention dan follow juga @MajalahSM dan @muhammadiyah,2019-12-03 07:25:48,audienspenanya pilih diskusi online interaktif sempat bulan langgan majalah sm digital orang menang komentar tentang tema twitter tagar mention follow juga dan
Diskusi Online Interaktif Bedah Editorial Majalah Suara Muhammadiyah Edisi 23 Tirai Hijrah. Langsung dari Pusat Syiar Digital Muhammadiyah serta video conference bersama Ketua PWM Jateng KH Tafsir di Semarang dan Dosen UMM Pradana Boy ZTF di Malang @pwmjateng @UMMcampus pic.twitter.com/BXqvjoDz27,2019-12-03 07:24:15,diskusi online interaktif bedah editorial majalah suara muhammadiyah edisi tirai hijrah langsung pusat syiar digital muhammadiyah video conference sama ketua pwm jateng kh tafsir semarang dosen umm pradana boy ztf malang
Fotografernya ajiibbbb,2019-12-03 07:07:04,fotografer ajiibbbb
LSP UMM Siap Jadi Tempat Uji Kompetensi Mandiri Penyuluh Anti-Korupsi | http://www.umm.ac.id/id/berita/lsp-umm-siap-jadi-tempat-uji-kompetensi-mandiri-penyuluh-antikorupsi.html … | #UMMCampuspic.twitter.com/1ahlYToMlF,2019-12-03 07:05:00,lsp umm siap jadi tempat uji kompetensi mandiri suluh antikorupsi
"Prodi Teknik Informatika UMM Raih Akreditasi A, Bersiap Songsong Akreditasi Internasional 2020 | http://www.umm.ac.id/id/berita/prodi-teknik-informatika-umm-raih-akreditasi-a-bersiap-songsong-akreditasi-internasional-2020.html … | #UMMCampuspic.twitter.com/1IlNa2ZinT",2019-12-03 06:43:20,prodi teknik informatika umm raih akreditasi a siap songsong akreditasi internasional
"Sewa mobil Manual/Mtic, khusus mhsiswa, syrt"" mudah, info langsung japri WA 082143712997 @infomalang @UB_Official @mahasiswamlg @infokostmalang @AremaBrawijaya @event_mahasiswa @polinema_malang @UINMalikiMalang @UMMcampus @MabaUMMker @Dpm_Feb_Unmer",2019-12-03 03:40:19,sewa mobil manualmtic khusus mhsiswa syrt mudah info langsung japri wa
"@KM_ITB @BEMUNAIR_ID @BEMUI_Official @bemkm_ugm @Bemkmipb @EM_UBofficial @BEM_ITS @UMMcampus @infoUINmaliki @Unpas_bandung @UnsoedOfficial @BEM_Unsoed @UIIYogyakarta @BEMUNS @UINSK @MahasiswaUNJ @SahaL_AS BOM diMedan+DLL PENJELASAN LENGKAP,LIHAT HAL.2 KLIK SINI +KLIK Lampiran2pic.twitter.com/oy7YbUDdIk",2019-12-02 15:02:19,bom dimedandll jelas lengkaplihat klik sini klik
Pendaftaran Mahasiswa Baru Tahun Akademik 2020/2021 di UMM telah dibuka mulai 1 Desember 2019-25 Agustus 2020 secara online: #PMBUMM (1) http://umm.ac.id (2) http://pmb.umm.ac.id dan (3) http://online.umm.ac.id . @UMMcampus @mahasiswaunmuh @UMMstory64,2019-12-02 10:09:59,daftar mahasiswa baru tahun akademik umm buka mulai desember agustus cara online
"Rayakan Milad ke-55 tahun, UMM gelar jalan santai @UMMcampus https://elshinta.com/news/194147/2019/12/02/rayakan-milad-ke55-tahun-umm-gelar-jalan-santai …",2019-12-02 08:25:03,raya milad tahun umm gelar jalan santai
@infomalang @PemkotMalang @Malang_Mbois @radar_malang @UMMcampus @malangeveryday @LalinNews @RRIMalang @eventmalang Yuuukkss gaeess jangan sampe ketinggalan neech... Buruan daftar gaaeess...pic.twitter.com/TSm68mz8Qt,2019-12-01 05:47:35,yuuukkss gaeess jangan sampe tinggal neech buru daftar
aku udah 2 tahun yang laluuu,2019-11-30 08:55:28,aku udah tahun laluuu
Mantab min,2019-11-30 08:54:45,mantab min
"selamat kepada adek adek mahasiswa @UMMcampus yang di wisuda hari ini, tetap tegakkan kepala, karna kalian akan menghadapi tantangan selanjutnya",2019-11-30 06:42:55,selamat adek adek mahasiswa di wisuda hari tetap tegak kepala karna kalian hadap tantang lanjut
"Siapa yang difoto ini retweet ya Selamat buat mas bro juga mbak bro yang telah merayakan seremoni perjuangan selama menimbah ilmu dikampus tercinta kita UMM "" Wisuda Angkatan 94 "" Gapailah cita citamu Dan terapkan ilmu yang kamu dapat untuk membantu masyarakat @UMMcampus pic.twitter.com/MFLV1fIxhe",2019-11-30 04:00:30,siapa foto retweet selamat buat mas bro mbak bro telah raya seremoni juang lama menimbah ilmu kampus cinta umm wisuda angkat gapai cita cita terap ilmu kamu untuk bantu masyarakat
Live streaming Wisuda Ke-94 Periode IV #UMMCampushttps://youtu.be/RkW3GjmN3X8,2019-11-30 02:07:59,live streaming wisuda periode iv
lapo mirrr kwkww,2019-11-30 01:07:47,lapo mirrr kwkww
ya Allah Mirzaaaa....,2019-11-30 00:23:50,allah mirzaaaa
Jangan sampai lupa ya gaes Online KRS dari manasaja sambil santuy. Ikuti jadwal dan lebih baik konsultasi dengan dosen pembimbing akademik biar gak salah @UMMcampus @HUMAS_UMM #krs #krsumm #kampusputih #ummpic.twitter.com/QjiFVW43fU,2019-11-29 08:31:22,jangan lupa gaes online krs manasaja santuy ikut jadwal lebih baik konsultasi dosen bimbing akademik biar gak salah
"Hai #SAHABATUBTV mimin dpt info nih dari @radio_ub! Cek deh: Buat mahasiswa @UB_Official, yg pengen nonton Andra and The Backbone dan Sal Priadi di event @smartfrenworld WOW Carnival 3 Des 2019 di Dome @UMMcampus, yuk isi form registrasi disini http://bit.ly/UBRadio . #Malang",2019-11-29 06:00:48,hai mimin dpt info nih cek deh buat mahasiswa yg ken nonton andra and the backbone sal priadi event wow carnival des dome yuk isi form registrasi sini
