text,date,cleaned_tweets
#JasMerahMob wajah Ketua Umum PP Muhammadiyah @HaedarNs. Beliau terdecak kagum saat melihat wajahnya saat penanyangan flashmob di UMM Dome!pic.twitter.com/TbjabD3Z4Z,2019-09-02 10:47:53,wajah ketua umum pp muhammadiyah beliau decak kagum lihat wajah penanyangan flashmob umm dome
#JasMerahMob tulisan Muktamar Muhammadiyah Ke-48 Flashmob untuk @Muktamar48 ini dilakukan 7.611 mahasiswa baru angkatan 2019 sambil menyanyikan lagu Sang Surya. Nantikan videonya ya!pic.twitter.com/ENU1HbfriF,2019-09-02 10:47:49,tulis muktamar muhammadiyah flashmob ini laku mahasiswa baru angkat nyanyi lagu sang surya video
"#JasMerahMob Memajukan Indonesia, Mencerahkan Semesta merupakan tema yang diusung di @Muktamar48.pic.twitter.com/XcQtw7UUi2",2019-09-02 10:47:47,maju indonesia cerah semesta rupa tema usung
"#JasMerahMob logo Muktamar Ke-48 Muhammadiyah Mendukung perhelatan akbar @muhammadiyah, #UMMCampus membuat logo kegiatan yang diselenggarakan untuk ke-48.pic.twitter.com/i8aPw1kVRn",2019-09-02 10:47:44,logo muktamar muhammadiyah dukung helat akbar buat logo giat selenggara
#JasMerahMob starter pack - Topi UMM - Jilbab putih (putri) - Dasi hitam UMM - Jas almamater - Kemeja putih - Ikat pinggang - Rok kain putih (putri) - Celana kain putih (putra) - Sepatu hitam - Berkaus kakipic.twitter.com/LuNQnAwVM5,2019-09-02 10:47:41,starter pack topi umm jilbab putih putri dasi hitam umm jas almamater kemeja putih ikat pinggang rok kain putih putri celana kain putih putra sepatu hitam kaus
"TUJUH FORMASI #JasMerahMob #PesmabaUMM2019 #UMMCampus tanpa bantuan alat seperti kertas atau payung. Hanya memakai baju yang dikenakan: topi, jas almamater, dan baju putih-putih yang tersemat! - A Thread",2019-09-02 10:47:38,tujuh formasi bantu alat kertas payung pakai baju kena topi jas almamater baju putihputih semat a thread
Saya salah satu alumninya,2019-09-02 10:47:25,salah satu alumni
Sumpa Sampek glodoki ndek wajah min wkwkwk,2019-09-02 10:46:56,sumpa sampek glodoki ndek wajah min wkwkwk
"Terselip, ojo isinan yo.",2019-09-02 10:46:08,selip ojo isinan yo
@UMMcampus tolong di adain dong wkwk,2019-09-02 10:41:56,di adain dong wkwk
Nuwun sewuuu @NUgarislucu @nahdlatululamapic.twitter.com/zxmcE1srIG,2019-09-02 10:40:36,nuwun sewuuu
"Maba @UMMcampus 2019 bikin #jasmerahmob membentuk wajah Ayahanda @HaedarNs yang sedang tersenyum. Diantara 7000 mahasiswa baru @UMMcampus dari Aceh hingga Papua dan mancanegara setiap tahunnya, biasanya terselip umat @NUgarislucu dan @KatolikG . pic.twitter.com/OzOqgjBdZQ",2019-09-02 10:32:17,maba bikin bentuk wajah ayahanda sedang senyum mahasiswa baru aceh hingga papua mancanegara tiap tahun biasa selip umat
Wah kreasi mahasiswa @UMMcampus https://twitter.com/muhammadiyah/status/1168457593682948096 …,2019-09-02 10:24:51,wah kreasi mahasiswa
Mantap @HimawanRichwan @nurudinwriter dkk di @UMMcampus https://twitter.com/muhammadiyah/status/1168457593682948096 …,2019-09-02 09:47:39,mantap dkk
#Repost @ummcampus with get_repost ・・・ Yang ditunggu-tunggu... video #JasMerahMob kreasi mahasiswa baru angkatan 2019! Flashmob apa yang jadi favoritmu? Share di komentar dan temanmu… https://www.instagram.com/p/B151wslHgJxeVqitSXNnO783zpYeP72klXLtjY0/?igshid=1w73vj4sksnyb …,2019-09-02 09:27:46,with getrepost ditunggutunggu video kreasi mahasiswa baru angkat flashmob apa jadi favorit share komentar teman
Ada sosok pak @HaedarNs di penerimaan mhs baru @UMMcampus Keren banget ini. pic.twitter.com/1mdSBqAwIu,2019-09-02 09:18:11,sosok pak terima mhs baru keren banget
Sarannya apa ya... entah lah...,2019-09-02 04:39:04,saran apa entah lah
Betul Rt .. semua perwakilan MHS Papua dan tokoh Anti NKRI di luar negeri Makin kompak mendorong freedom. Intel kita telat nguping nya @fahiraidris @SumaUI @ukm_official @jokowi @UNJ_Official @paramadina @UMMcampus @UniversitasUKRI @unklabgrads @Pak_JK @milapisiway @Nanawidyawhttps://twitter.com/musniumar/status/1168359050955784192 …,2019-09-02 04:26:18,betul rt semua wakil mhs papua tokoh anti nkri luar negeri makin kompak dorong freedom intel telat nguping nya
"Udah ada kesimpulan, tambahin saran mal",2019-09-02 04:22:38,udah simpul tambahin saran mal
Astaga... penarikan kesimpulan yang menarik,2019-09-02 03:54:21,astaga tari simpul tarik
Kemungkinan lainnya adalah: cowoknya ngondek,2019-09-02 03:51:30,mungkin adalah cowok ngondek
Dari Muhammadiyah untuk Bangsa @UMMcampus Selamat pesmaba yaaa adik adik. pic.twitter.com/k56mnC1wSb,2019-09-02 03:13:13,muhammadiyah bangsa selamat pesmaba yaaa adik adik
"3 cewek dan 1 cowok,, apakah umm menghendaki poligami?",2019-09-02 03:09:40,cewek cowok umm hendak poligami
suaranya mana pesmaba 2012,2019-09-02 01:58:03,suara mana pesmaba
kok yo pas aku wes lulus,2019-09-02 01:28:34,kok yo pas aku wes lulus
Pembukaan #pesmabaumm2019 @UMMcampus pic.twitter.com/Tffp9h18Ix,2019-09-02 00:58:18,buka
Selamat datang adek-adek nan menggemaskan..,2019-09-02 00:03:53,selamat datang adekadek nan gemas
Slamat dateng dek,2019-09-02 00:01:39,slamat dateng dek
Selamat datang mahasiswa baru angkatan 2019! #PesmabaUMM2019 #UMMCampuspic.twitter.com/GYZjeDK35M,2019-09-02 00:00:00,selamat datang mahasiswa baru angkat
"kejutannya, tiba2 dospem mu ngajak bimbingan mendadak",2019-09-01 23:44:33,kejut tiba dospem mu ngajak bimbing dadak
FORTASI (Forum Taaruf dan Orientasi) Mahasiswa Fisioterapi Fakultas Ilmu Kesehatan Universitas Muhammadiyah Malang . . @ummcampus himateraumm @Fikes Umm Kampus II https://www.instagram.com/p/B13vZjknDQ3/?igshid=ok6em7qgf5er …,2019-09-01 13:52:38,fortasi forum taaruf orientasi mahasiswa fisioterapi fakultas ilmu sehat universitas muhammadiyah malang himateraumm umm kampus ii
"Siap, silahkan berkreasi masing2",2019-09-01 09:08:41,siap silah kreasi masing
@MuhammadiyinGL Nanti @UMMcampus Bikin juga deh,2019-09-01 09:01:02,bikin deh
Ditemukan stnk A.N Asopah ini bisa diambil di lalapan sambel killer tirto utomo @infomalang @UMMcampus @mahasiswamlg,2019-09-01 08:03:38,temu stnk an asopah bisa ambil lalap sambel killer tirto utomo
Ditemukan ktp A.N Nabilah Ifani Aflah ini bisa diambil di lalapan sambel killer tirto utomo @infomalang @UMMcampus @mahasiswamlg,2019-09-01 08:02:44,temu ktp an nabi ifani aflah bisa ambil lalap sambel killer tirto utomo
@UMMcampus tiap menyelenggarakan wisuda selalu seperti ini apakah ada upaya untuk menyelesaikan? Sudah 3 tahun selalu seperti ini dengan durasi kemacetan yang sulit ditoleransi. pic.twitter.com/G5MArarjuF,2019-08-31 14:23:28,tiap selenggara wisuda selalu ini ada upaya selesai tahun selalu ini durasi macet sulit toleransi
Gini masuk evaluasi kajian amdalalin @UMMcampus ndak sih? Macet parah. Cc: @PemkotMalang @dishubjatim @DishubMalang @JatimPemprov @e100ss @TidarSaktiFM,2019-08-31 08:21:07,gin masuk evaluasi kaji amdalalin ndak sih macet parah cc
@UMMcampus karena wisuda mahasiswanya jalan jari macet total. Apa gak bisa diatur gitu? Cc @infomalang,2019-08-31 08:05:39,wisuda mahasiswa jalan jari macet total apa gak atur gitu cc
Gapaham lagi :(,2019-08-31 02:32:34,gapaham
"Dear wisudawan dan wisudawati hari ini di @UMMcampus yg klo gk salah berjumlah 2.330 orang, Selamat menempuh hidup baru. Bukan lagi hidup sebagai mahasiswa. Selamat naik level dan menemukan perjuangan yang sesungguhnya. Salam, Alumni UMM",2019-08-31 02:31:48,dear wisudawan wisudawati hari di yg klo gk salah jumlah orang selamat tempuh hidup baru bukan hidup bagai mahasiswa selamat naik level temu juang sungguh salam alumni umm
Ealah sampe ditagg,2019-08-31 02:30:03,ealah sampe ditagg
Eh ya gak gitu :(,2019-08-31 02:28:33,eh gak gitu
@UMMcampus dipanggil nih,2019-08-31 02:18:21,panggil nih
"@UMMcampus min, dimana aku bisa menemukan foto resmi dekan dan wakilnya fikes yaaa hmmm",2019-08-30 16:41:29,min mana aku temu foto resmi dekan wakil fikes yaaa hmmm
Siaaaaap,2019-08-30 03:19:55,siaaaaap
Haduuuuu.... Itu salah jasnya atau...,2019-08-30 03:19:43,haduuuuu salah jas
@UMMcampus tahun lalu malah ngundang Via Vallen. Kurang apa coba?,2019-08-30 00:12:37,tahun lalu malah ngundang via vallen kurang apa coba
"Buat panitia pesmaba, nitip dedek-dedek gemes jangan dimarahin yaa",2019-08-29 11:51:09,buat panitia pesmaba nitip dedekdedek gemes jangan dimarahin yaa
"haduh Sik min, Jas ku kekecilan :(",2019-08-29 11:49:13,haduh sik min jas ku kecil
Nitip para maba jangan di eksekusi kalo ngospeki ya,2019-08-29 10:42:04,nitip maba jangan eksekusi kalo ngospeki
siappp,2019-08-29 09:51:32,siappp
Sayap grak,2019-08-29 09:46:03,sayap grak
Siap untuk #JasMerahMob #PesmabaUMM2019?,2019-08-29 09:44:48,siap
Pernyataan yg hakiki Bangsa Papua @fahiraidris @mediaindonesia @Metro_TV @FA_Sukoharjo @sukoharjo_kab @CISCbrebes_ @BIGREDS_Tegal @UMMcampus @BurhanMuhtadi @saiful_mujani @bucinskincare @marlinamukti @mukaduaaa @niasolin @BIGREDS_PKL @MFMBatang @mulesyaberak @CISCpemalang @uajyhttps://twitter.com/FreeWestPapua/status/1166661883128111104 …,2019-08-28 17:28:48,nyata yg hakiki bangsa papua
Plizzz siapa tokoh Indonesia yg mampu berdialog matang hakekat hidup dalam damai sejahtera ?? @mahasiswaUNS @UMMcampus @UNJ_Official @univ_indonesia @KompasTV @Metro_TV @mediaindonesia @CISCngawi @anakmudamagetan @MuhammadMika031 @PPPemudaMu @puspitacsr @unmuha @BEMUNShttps://twitter.com/NOS/status/1166693108270153729 …,2019-08-28 17:23:08,plizzz siapa tokoh indonesia yg mampu dialog matang hakekat hidup damai sejahtera
"Persiapan Diksuswati Tiga Nasional DPD IMM Sulsel, Pimpinan Silaturahim ke Ketua PWM https://www.pedulirakyat.co.id/persiapan-diksuswati-tiga-nasional-dpd-imm-sulsel-pimpinan-silaturahim-ke-ketua-pwm/3372/ … lewat @Pedulirakyatcoi.co.id @dppimm @IMMnews @imm_mks @MDMCIndonesia @UMMcampus",2019-08-28 09:43:52,siap diksuswati tiga nasional dpd imm sulsel pimpin silaturahim ketua pwm lewat coid
"#INFO #DonDar #Malang | 28 Agustus 2019 | 08.00 - selesai | Persada Hospital, Jl. Raden Panji Suroso No. 4 | @june_bfl cc @PemkotMalang @AremafcOfficial @UMMcampus @PersadaHospital @polinema_malang @UM_1954pic.twitter.com/AXrv1p66xU",2019-08-28 02:03:58,agustus selesai persada hospital jl raden panji suroso no cc
Sini ke malang:(,2019-08-27 01:10:52,sini malang
Ikut kemana mar wkwk,2019-08-27 01:10:03,ikut mana mar wkwk
"#INFO #DonDar #Malang | 28 Agustus 2019 | 08.00 - selesai | Persada Hospital, Jl. Raden Panji Suroso No. 4 | @june_bfl cc @PemkotMalang @AremafcOfficial @UMMcampus @PersadaHospital @polinema_malang @UM_1954pic.twitter.com/5zSSjhqPeo",2019-08-26 16:15:06,agustus selesai persada hospital jl raden panji suroso no cc
"Untungnya ""masa masa itu"" udh lewat mal wkwkwk",2019-08-26 08:52:22,untung masa masa udh lewat mal wkwkwk
Semogaa gak sampe banyak editan kek taun lalu,2019-08-26 08:35:58,semogaa gak sampe banyak edit kek taun lalu
"@UMMcampus permis, pendaftaran s3 pai umm sampai kapan ya? Download form rekomendasi nya dimana ya? Terimakasih",2019-08-23 22:41:39,permis daftar s pai umm kapan download form rekomendasi nya mana terimakasih
"salah satu rangkaian pengenalan kampus di UMM @UMMcampus gini kok kak ^^, hehe.. masuk pesantren selama seminggu ^^ tapi mengenai lulus IPKnya 4.00 semua sih itu bergantung usaha masing2 lagi semasa kuliahnya ^^ https://twitter.com/yeahmahasiswa/status/1164730089327566849 …",2019-08-23 02:46:55,salah satu rangkai kenal kampus umm gin kok kak hehe masuk pesantren lama minggu kena lulus ipknya semua sih gantung usaha masing masa kuliah
Skr bangunan bnyak bermunculan,2019-08-23 01:14:40,skr bangun bnyak muncul
Ya aku lah,2019-08-22 11:57:56,aku lah
Kamu siapa siii,2019-08-22 11:44:51,kamu siapa siii
Min @UMMcampus ini container samping rusunawa lagi mau bangun apa ya? pic.twitter.com/pV22sm02xE,2019-08-22 11:21:15,min container samping rusunawa mau bangun apa
Mohon buka aku InstaGram supaya info² tentang kajian ilmu dan ustadz yang membawakan materi nya bisa di upload disitu. Syukron - jazakumulloh khoir..,2019-08-22 09:38:45,mohon buka aku instagram info kaji ilmu ustadz bawa materi nya di upload situ syukron jazakumulloh khoir
"Kera Ngalam, Ndang Melu O @Kemendag @Kemenperin_RI @KemenkopUKM @PemkotMalang @unmermlg @UMMcampus @Polinema3 @ITN_Malang @bank_indonesia @KemenkeuRIpic.twitter.com/H2jQFpbLsq",2019-08-22 07:53:27,kera ngalam ndang melu o
Kerja sama internasional #UMMCampus sudah terjaring di banyak negara dan organisasi. Di antaranya lewat program #ErasmusPlus dan @AIESECUMM. Pojok budaya seperti dari @amcorUMM juga tersedia di kampus kami. Selengkapnya di video profil berikut ini:).https://youtu.be/wIWzadgbRVA?t=319 …,2019-08-22 07:46:28,kerja sama internasional jaring banyak negara organisasi antara lewat program pojok budaya dari sedia kampus lengkap video profil ikut
Nggak ragu soale wis mlebu pil wkwk,2019-08-22 06:56:53,ragu soale wis mlebu pil wkwk
Aku juga hehe,2019-08-22 06:21:48,aku hehe
Masi ragu kuliah di @UMMcampus??? Aku sih enggaaa https://twitter.com/UMMcampus/status/1164398131573710849 …,2019-08-22 05:26:41,mas ragu kuliah aku sih enggaaa
"Berbagai alasan jadi motivasi mahasiswa memilih #UMMCampus. Chayrul Ahmad menjatuhkan pilihan pertamanya untuk UMM. Simak alasan perancang desain jembatan kaca di KWJ ini selengkapnya! Raih mimpi, prestasi, & inspirasi seperti Chayrul dengan daftar di http://online.umm.ac.id .pic.twitter.com/c2WXn6DM8l",2019-08-22 04:45:22,bagai alas jadi motivasi mahasiswa pilih chayrul ahmad jatuh pilih pertama umm simak alas ancang desain jembatan kaca kwj lengkap raih mimpi prestasi inspirasi chayrul daftar
Yakin nggak mau ospek di #UMMCampus ajahttps://twitter.com/zakidisini_/status/1164125809084264448 …,2019-08-22 04:41:57,yakin mau ospek ajahttps
@UMMcampus ngga mau retweet juga min?,2019-08-21 10:48:57,ngga mau retweet min
Gk pernah bosan foto pemandangan ini @UMMcampus pic.twitter.com/gePNnXX8sA – at Gedung Kuliah Bersama (GKB) 2,2019-08-21 05:23:04,gk pernah bosan foto pandang at gedung kuliah sama gkb
Segera daftarkan dirimu untuk kuliah di Sosiologi FISIP UMM sebelum waktunya habis! Masih ada hari ini dan besok! @ummcampus fisip_umm himasos.umm #kuliah #pendaftaran #pendaftarankuliah #sosiologiumm #sosiologi… https://www.instagram.com/p/B1aRkVqH_4E/?igshid=e8inzwqerdcf …,2019-08-21 03:13:58,segera daftar diri kuliah sosiologi fisip umm waktu habis ada hari dan besok fisipumm himasosumm
Cocok Dadi dosen ayas ya,2019-08-20 21:54:02,cocok dadi dosen ayas
Mantap pak suhe.,2019-08-20 13:33:52,mantap pak suhe
"Aku cinta mimin , keren kamu ini",2019-08-20 11:51:33,aku cinta mimin keren kamu
Mobil KaCa UMM Sosialisasi Mitigasi Bencana di Lereng Semeru | http://www.umm.ac.id/id/berita/mobil-kaca-umm-sosialisasi-mitigasi-bencana-di-lereng-semeru.html … | #UMMCampuspic.twitter.com/b5ly0BFBQC,2019-08-20 10:11:57,mobil kaca umm sosialisasi mitigasi bencana lereng meru
Artinyaaaaa….,2019-08-20 10:10:51,artinyaaaaa
Wah… Selamat!,2019-08-20 10:10:28,wah selamat
"Kenalkan Budaya Malang di Forum Internasional, AIESEC in UMM Gelar Global Village Festival Summer @UMMcampus @HUMAS_UMMhttps://www.telaah.id/2019/08/20/kenalkan-budaya-malang-di-forum-internasional-aiesec-in-umm-gelar-global-village-festival-summer/ …",2019-08-20 06:40:43,kenal budaya malang forum internasional aiesec in umm gelar global village festival summer
"Alhamdulillah, thank you @UMMcampus pic.twitter.com/mmRNEd4mlR",2019-08-20 04:44:25,alhamdulillah thank you
@UMMcampus min pengumuman jam berapa ya?,2019-08-20 02:37:32,min umum jam berapa
"Begini pendapat Hendrik Udiawan, seorang lulusan Fakultas Ilmu SOSIAL dan Ilmu Politik Universitas Muhammadiyah Malang @UMMcampus https://twitter.com/Henryawan_14/status/1163347925822390272 …",2019-08-19 08:06:14,begini hendrik udiawan orang lulus fakultas ilmu sosial ilmu politik universitas muhammadiyah malang
Duh dhinaju bule wkwk,2019-08-19 07:56:34,duh dhinaju bule wkwk
"Banjar min ai, mun mimin pang apa?",2019-08-19 06:44:09,banjar min ai mun mimin pang apa
Bantu Pasarkan Tape Singkong Banjarsari Lewat Medsos | http://www.umm.ac.id/id/berita/bantu-pasarkan-tape-singkong-banjarsari-lewat-medsos.html … | #UMMCampuspic.twitter.com/4GZgXOblg0,2019-08-19 05:32:00,bantu pasar tape singkong banjarsari lewat medsos
"Heng ono min, heng masok peno iki",2019-08-19 05:20:35,heng ono min heng masok peno iki
Sumatra hingga Papua tertata Tujuh puluh empat tahun merdeka Beragam bahasa milik kita Bhinneka Tunggal Ika Rayakan peringatan HUT Ke-74 Republik Indonesia lewat keberagaman bahasa yang tersaji di Kaleidoskop Juli 2019. Ada bahasa daerahmu? #ummcampuspic.twitter.com/Wdju0PxrsX,2019-08-19 04:49:00,sumatra hingga papua tata tujuh puluh empat tahun merdeka agam bahasa milik bhinneka tunggal ika raya ingat hut republik indonesia lewat agam bahasa saji kaleidoskop juli bahasa daerah
"Siap jadi mahasiswa baru UMM? Daftar di http://online.umm.ac.id ya... Yuk kenali dulu jumlah prodi sarjana, magister, dan doktoral di #UMMCampus dan akreditasinya! Selengkapnya, bisa kamu baca di sini http://bit.ly/AkreditasiProdiUMM … yaaa. Cat.: Penghitungan profesi di kolom sarjanapic.twitter.com/hsMVOXEKPU",2019-08-19 04:26:49,siap jadi mahasiswa baru umm daftar ya yuk kenal dulu jumlah prodi sarjana magister doktoral dan akreditasi lengkap kamu baca sini yaaa cat hitung profesi kolom
"Wayahe Ospek titip adek2 MABA sak madya, Seng logis & edukatif. Malang pencetak generasi Cerdas bukan penindas. @infomalang @mahasiswamlg @UMMcampus @UB_Official @UINMalikiMalang @unisma193 @polinema_malang @humas_itnmalang",2019-08-18 23:50:08,wayahe ospek titip adek maba sak madya seng logis edukatif malang cetak generasi cerdas bukan tindas
35. @UMMcampus Yogyakarta (klaster 2) 36. @unsri (klaster 2) 37. @klik_uad (klaster 2) 38. @UMMcampus Malang (klaster 2) 39. Universitas Sanata Dharma (klaster 2) 40. Universitas Pembangunan Nasional Veteran Jatim (klaster 2) 41. Universitas Pendidikan Ganesha (klaster 2),2019-08-18 09:25:57,yogyakarta klaster klaster klaster malang klaster universitas sanata dharma klaster universitas bangun nasional veteran jatim klaster universitas didik ganesha klaster
14 tahun Antimainstream jarene,2019-08-17 10:54:09,tahun antimainstream jarene
min mau nanya. untuk bebas tanggungan wisuda periode 3 selain di jurusan sama perpus ada lagi apa enggak? makasih @UMMinfo @UMMcampus,2019-08-17 04:00:13,min mau nanya bebas tanggung wisuda periode di jurus sama pus lagi apa enggak makasih
"Aman min, lantai 3 wes dikosongi..",2019-08-17 03:47:11,aman min lantai wes kosong
"Lossss langsung, koyok bisul pecah.",2019-08-17 03:12:55,lossss langsung koyok bisul pecah
"Tenang, gak nang stadion",2019-08-17 03:11:55,tenang gak nang stadion
loss gak rewel,2019-08-17 02:56:49,loss gak rewel
Awas kenek dendo pssi,2019-08-17 02:40:59,awas kenek dendo pssi
PT Kereta Api Logistik siap melayani #SobatMalangTramway yg perlu mengirimkan barang lewat angkutan logistik kereta api. Info layanan bisa ditanyakan pada stasiun kereta api setempat https://kereta-api.info/lokasi-kantor-pusat-dan-perwakilan-pt-kereta-api-logistik-kalog-5003.htm … cc @infomalang @mahasiswamlg @UB_Official @UM_1954 @UMMcampus @PuspitaFM,2019-08-17 02:33:42,pt kereta api logistik siap layan yg perlu kirim barang lewat angkut logistik kereta api info layan tanya stasiun kereta api tempat cc
Awas ngeneki koncone..,2019-08-17 02:31:09,awas ngeneki koncone
Beres. Masih ada ospek di sana ramai,2019-08-16 20:45:54,beres ada ospek sana ramai
Mampir ke ub coffee pak,2019-08-16 17:29:09,mampir ub coffee pak
Ini mah anak UMM habis UAS @UMMcampus https://twitter.com/idolfess/status/1162364819825033216 …,2019-08-16 14:11:02,mah anak umm habis uas
UMM kampusku @UMMcampus https://twitter.com/fajarjun/status/1162021454507982848 …,2019-08-16 11:32:02,umm kampus
Surat edaran tentang akun resmi Medsos kampus UMM. Karena tak sedikit akun2 yang mengatasnamakan UMM tetapi merugikan kampus. @UMMcampus #UMMCampus #umm #kampusumm #jasmerahkampusputihpic.twitter.com/PcF5x93KNE,2019-08-16 02:35:56,surat edar akun resmi medsos kampus umm tak sedikit akun mengatasnamakan umm rugi kampus
Jombang Minta UMM Lejitkan Potensi Daerahnya | http://www.umm.ac.id/id/berita/jombang-minta-umm-lejitkan-potensi-daerahnya.html … | #UMMCampuspic.twitter.com/1naqdJvm0e,2019-08-16 01:01:00,jombang minta umm lejit potensi daerah
Hmmm sepertinyaa,2019-08-15 13:30:56,hmmm sepertinyaa
Dosen UMM Gagas Kaderisasi Petani Kopi Berbasis Literasi | http://www.umm.ac.id/id/berita/dosen-umm-gagas-kaderisasi-petani-kopi-berbasis-literasi.html … | #UMMCampuspic.twitter.com/LMFQgWStR0,2019-08-15 12:15:00,dosen umm gagas kaderisasi tani kopi bas literasi
BIPA UMM Latih PTN/PTS Pengajaran Bahasa Indonesia untuk Mahasiswa Asing | http://www.umm.ac.id/id/berita/bipa-umm-latih-ptnpts-pengajaran-bahasa-indonesia-untuk-mahasiswa-asing.html … | #UMMCampuspic.twitter.com/Uui2K9frKh,2019-08-15 11:57:00,bipa umm latih ptnpts ajar bahasa indonesia mahasiswa asing
UMM Siapkan Skema KKN Dampingi TKI di Kinabalu | http://www.umm.ac.id/id/berita/umm-siapkan-skema-kkn-dampingi-tki-di-kinabalu.html … | #UMMCampuspic.twitter.com/Vf5kpx9kuQ,2019-08-15 11:45:00,umm siap skema kkn damping tki kinabalu
"Lewat Outbond, Mobil Pintar UMM Bikin Dua Sekolah Ini Kompak | http://www.umm.ac.id/id/berita/lewat-outbond-mobil-pintar-umm-bikin-dua-sekolah-ini-kompak.html … | #UMMCampuspic.twitter.com/FSSPRVl6OK",2019-08-15 11:30:00,lewat outbond mobil pintar umm bikin sekolah kompak
IKA UMM Gelar Reuni Ruang Rindu | http://www.umm.ac.id/id/berita/ika-umm-gelar-reuni-ruang-rindu.html … | #UMMCampuspic.twitter.com/be5cY74Dl3,2019-08-15 11:15:00,ika umm gelar reuni ruang rindu
Saya mengendus bau bau SKM disana. Huhuhu,2019-08-15 11:13:59,endus bau bau skm sana huhuhu
@Hardiansjah_ gimna nih,2019-08-15 11:00:02,gimna nih
UMM-Kukar Teken Kerjasama Pendirian Pusat Pendidikan Vokasi | http://www.umm.ac.id/id/berita/ummkukar-teken-kerjasama-pendirian-pusat-pendidikan-vokasi.html … | #UMMCampuspic.twitter.com/TyGoMaX8Nt,2019-08-15 11:00:01,ummkukar teken kerjasama diri pusat didik vokasi
UMM Resmi Buka Prodi Profesi Fisioterapi | http://www.umm.ac.id/id/berita/umm-resmi-buka-prodi-profesi-fisioterapi.html … | #UMMCampuspic.twitter.com/hlEPDGLzZl,2019-08-15 10:46:00,umm resmi buka prodi profesi fisioterapi
Mobil KaCa di Donomulyo: Dorong Siswa Kuliah hingga Beri Inspirasi Wirausaha lewat Kelas Barista | http://www.umm.ac.id/id/berita/mobil-kaca-di-donomulyo-dorong-siswa-kuliah-hingga-beri-inspirasi-wirausaha-lewat-kelas-barista.html … | #UMMCampuspic.twitter.com/ZSffD89GnB,2019-08-15 10:36:00,mobil kaca donomulyo dorong siswa kuliah hingga beri inspirasi wirausaha lewat kelas barista
"Tingkatkan Kualitas, Prodi Ekonomi Syari’ah UMM Raih Akreditasi B | http://www.umm.ac.id/id/berita/tingkatkan-kualitas-prodi-ekonomi-syari …’ah-umm-raih-akreditasi-b.html | #UMMCampuspic.twitter.com/Gq2NYcDsqP",2019-08-15 10:09:55,tingkat kualitas prodi ekonomi syar ah umm raih akreditasi b ahummraihakreditasibhtml
Spray Anti Nyamuk Alami untuk Cegah Demam Berdarah | http://www.umm.ac.id/id/berita/spray-anti-nyamuk-alami-untuk-cegah-demam-berdarah.html … | #UMMCampuspic.twitter.com/E97y7fFCgd,2019-08-15 07:26:06,spray anti nyamuk alami cegah demam darah
Kenalkan Teh Herbal Rambut Jagung #malangpost @UMMcampus @KKN94UMM @kkn69umm @kkn09umm https://malang-post.com/pendidikan/kenalkan-teh-herbal-rambut-jagung …,2019-08-14 00:58:24,kenal teh herbal rambut jagung
pertamina juga kanda,2019-08-13 11:34:29,pertamina kanda
"jan memang pernah ko maso dome, sengakling sama umm inn",2019-08-13 11:15:10,jan memang pernah ko maso dome sengakling sama umm inn
lebih lebay,2019-08-13 11:13:52,lebih lebay
@UMMcampus menyusul september sam,2019-08-13 10:34:10,susul september sam
Iya kasian ya Padahal masih muda,2019-08-13 05:32:04,iya kasi padahal muda
Ke malang dongggggg,2019-08-13 05:28:58,malang dongggggg
Tinggal kenangan buat @nabilaekka,2019-08-13 05:26:01,tinggal kenang buat
Tami capcay yg sering keabisan,2019-08-12 23:46:32,tam capcay yg sering abis
"Anceeneeee bonek kgn motoran trs kejebak hujan, dicipratin wong2 trs matamu melotot smbil metu sby e wkwkkwkw meso2 parah hahaaa",2019-08-11 09:57:46,anceeneeee bonek kgn motor trs jebak hujan dicipratin wong trs mata melotot smbil metu sby e wkwkkwkw meso parah hahaaa
Berasa aku dulu itu ancen segalak itu ambe uwong ya cik,2019-08-11 09:52:27,asa aku dulu ancen galak ambe uwong cik
Kgn dehhh liat kamu pelototin mbak2 yg dgn muka tak bersalah tiba2 duduk di kursi meja kita :( wkwkkwk,2019-08-11 09:51:27,kgn dehhh liat kamu pelototin mbak yg dgn muka tak salah tiba duduk kursi meja wkwkkwk
Lha mas iki sido kuliah luar negeri ? Menghilang dari peredaran @UMMcampus,2019-08-11 08:00:13,lha mas iki sido kuliah luar negeri hilang edar
Wkwkwk ntar ada smping rusun,2019-08-11 05:49:13,wkwkwk ntar smping rusun
Sejak kapan kantek jadi spti ini min? Ya Allahh... Dulu biasa aja. Wkwkwkwk...,2019-08-11 05:44:59,sejak kapan kantek jadi spti min allahh dulu biasa aja wkwkwkwk
Menggendut cuma gr2 njajan muluuu di 3.5,2019-08-11 04:02:04,gendut cuma gr njajan muluuu
Pengurus Majelis Lingkungan Hidup PP.Muhammadiyah mengucapkan Selamat Hari Raya Idul Adha 1440 H @HaedarNs @Mas_AbdulMukti @MPSMuhammadiyah @MDMCIndonesia @diktilitbang @BNPB_Indonesia @AkademikUmy @majalahSM @TVMuhammadiyah @Menara62com @LAZISMU @unisa_yogya @klik_uad @UMMcampus pic.twitter.com/CpTj6jDb65,2019-08-11 03:17:51,urus majelis lingkung hidup ppmuhammadiyah ucap selamat hari raya idul adha h
Alhamdulillah muhammadiyah selalu bersinar sesuai lambangnya sang surya #hw muhammadiyahpic.twitter.com/DBcXRBXDE7,2019-08-11 02:51:45,alhamdulillah muhammadiyah selalu sinar sesuai lambang sang surya
